,Document,Topic,Name,Top_n_words,Probability,Representative_document
31,"rt : ""glamorous"" officer rasvinder agalliu found with class a #drugs, a #cannabis farm and a large quantity of cash. n",2,2_arrested_police_seized_man,arrested - police - seized - man - farm - marijuana - ndlea - two - worth - found,0.834755452,FALSE
101,rt : atm bombers arrested this morning primrose cbd well done saps and all involved,2,2_arrested_police_seized_man,arrested - police - seized - man - farm - marijuana - ndlea - two - worth - found,1,FALSE
273,"ndlea uncovers, destroys cannabis sativa farm in ire ekiti",2,2_arrested_police_seized_man,arrested - police - seized - man - farm - marijuana - ndlea - two - worth - found,0.677796531,FALSE
531,"a man, aged , has been arrested following a successful drugs warrant in #telford this morning (friday nov). officers carried out the warrant in #ketley, where they found evidence of a recent cannabis cultivation. read more here:",2,2_arrested_police_seized_man,arrested - police - seized - man - farm - marijuana - ndlea - two - worth - found,1,FALSE
549,police say he was an established cannabis dealer,2,2_arrested_police_seized_man,arrested - police - seized - man - farm - marijuana - ndlea - two - worth - found,1,FALSE
609,sligo man caught with over k of cannabis given suspended sentence -,2,2_arrested_police_seized_man,arrested - police - seized - man - farm - marijuana - ndlea - two - worth - found,1,FALSE
633,"tomasz waga, , was allegedly murdered by members of an albanian drugs gang after he burgled a cannabis factory in cardiff",2,2_arrested_police_seized_man,arrested - police - seized - man - farm - marijuana - ndlea - two - worth - found,0.597493916,FALSE
722,rt : video shows officers celebrating their seizure of tons of cannabis sativa from the warehouse of a c,2,2_arrested_police_seized_man,arrested - police - seized - man - farm - marijuana - ndlea - two - worth - found,0.81106836,FALSE
750,rt : renton police are trying to id two armed robbery suspects who held up the smoke and vapor at rainier ave s last thu,2,2_arrested_police_seized_man,arrested - police - seized - man - farm - marijuana - ndlea - two - worth - found,1,FALSE
828,"agentes de la policia local de marchena intervinieron ms de un kilo y medio de marihuana y casi gramos de hachs en la tarde del viernes en un club de cannabis en marchena, ubicado en un polgonoindustrial, deteniendo a una persona como presunto",2,2_arrested_police_seized_man,arrested - police - seized - man - farm - marijuana - ndlea - two - worth - found,0.977266361,FALSE
903,officers carried out drug searches warrants at neighbouring properties in balunie ave #dundee this morning. a -year-old woman has been arrested after worth of cannabis was recovered. enquiries ongoing. if you are concerned about drugs in your local area call .,2,2_arrested_police_seized_man,arrested - police - seized - man - farm - marijuana - ndlea - two - worth - found,1,FALSE
1050,"rt : 'action on illegal transportation through railways"".. under #operationnarcos recovered kg (approx) cannabis (ganja) from a",2,2_arrested_police_seized_man,arrested - police - seized - man - farm - marijuana - ndlea - two - worth - found,0.797092557,FALSE
1093,three arrested after cannabis farm found in birkenhead warehouse,2,2_arrested_police_seized_man,arrested - police - seized - man - farm - marijuana - ndlea - two - worth - found,1,FALSE
1138,"christian kuta-dankwa, , travelled to edgware where he saw mohamoud mohamed mahdi dealing cannabis. he thought mahdi was dealing ""on his strip."" in the ensuing fight mahdi was stabbed to death three times in the back. he was found guilty of murder.",2,2_arrested_police_seized_man,arrested - police - seized - man - farm - marijuana - ndlea - two - worth - found,0.500799982,FALSE
1142,state police arrest two in wilton for possessing pounds of cannabis,2,2_arrested_police_seized_man,arrested - police - seized - man - farm - marijuana - ndlea - two - worth - found,1,FALSE
1152,albanian drug dealer who entered country illegally and was caught with knife and of cannabis is jailed for a year,2,2_arrested_police_seized_man,arrested - police - seized - man - farm - marijuana - ndlea - two - worth - found,1,FALSE
1363,rt : a witness took this video of danny lim being handcuffed by officers in the cbd this morning.,2,2_arrested_police_seized_man,arrested - police - seized - man - farm - marijuana - ndlea - two - worth - found,1,FALSE
1396,rt : suspect held after chinese nationals killed at us cannabis farm,2,2_arrested_police_seized_man,arrested - police - seized - man - farm - marijuana - ndlea - two - worth - found,1,FALSE
1398,suspect held after four chinese nationals killed at us cannabis farm #hennessey #uscannabisfarmmurders #oklahomaquadruplehomicide #kingfishercounty #southend #usnews #knutsford #unitedstates,2,2_arrested_police_seized_man,arrested - police - seized - man - farm - marijuana - ndlea - two - worth - found,1,FALSE
1639,las vestidas de policia se fumaron el cannabis,2,2_arrested_police_seized_man,arrested - police - seized - man - farm - marijuana - ndlea - two - worth - found,0.623629822,FALSE
1769,guyana police destroy more than half a billion dollars in cannabis - st vincent times #cannabisnews,2,2_arrested_police_seized_man,arrested - police - seized - man - farm - marijuana - ndlea - two - worth - found,1,FALSE
1810,famagusta man arrested for cannabis possession | cyprus mail,2,2_arrested_police_seized_man,arrested - police - seized - man - farm - marijuana - ndlea - two - worth - found,1,FALSE
1877,"#cannabiscommunity #marijuana #cannabis taiwanese, indonesians indicted for largest marijuana seizure in taiwans history | taiwan news taipei (taiwan news) eight suspects, including two",2,2_arrested_police_seized_man,arrested - police - seized - man - farm - marijuana - ndlea - two - worth - found,0.555454525,FALSE
2098,"drug dealer held with cannabis in kurigram a drug dealer was arrested at phulbari upazila in kurigram district early friday.the arrested was siam, son of harunur rashid, a resident of balatari village",2,2_arrested_police_seized_man,arrested - police - seized - man - farm - marijuana - ndlea - two - worth - found,1,FALSE
2104,two men have been charged after police discovered a cannabis farm in willenhall town centre.,2,2_arrested_police_seized_man,arrested - police - seized - man - farm - marijuana - ndlea - two - worth - found,1,FALSE
2199,#cannabis #marijuana #thc #cannabiscommunity man accused of illegal possession of firearm and marijuana a man was arrested on suspicion of illegally possessing a firearm and possessing more than the legal limit of marijuana on,2,2_arrested_police_seized_man,arrested - police - seized - man - farm - marijuana - ndlea - two - worth - found,1,FALSE
2232,monticello man arrested cbd gummies from store clerk - mid hudson news #cannabis #marijuana,2,2_arrested_police_seized_man,arrested - police - seized - man - farm - marijuana - ndlea - two - worth - found,1,FALSE
2282,cannabis farm found inside middleton home with drugs warrant,2,2_arrested_police_seized_man,arrested - police - seized - man - farm - marijuana - ndlea - two - worth - found,1,FALSE
2292,police operation sees arrests and nearly m of cannabis seized:,2,2_arrested_police_seized_man,arrested - police - seized - man - farm - marijuana - ndlea - two - worth - found,1,FALSE
2351,man (20s) due in court after cannabis worth k seized in co kilkenny,2,2_arrested_police_seized_man,arrested - police - seized - man - farm - marijuana - ndlea - two - worth - found,1,FALSE
2413,developing: a third suspect will face court today accused of gang raping two women in a cbd carpark. the latest in news adelaide at pm and pm | #7news,2,2_arrested_police_seized_man,arrested - police - seized - man - farm - marijuana - ndlea - two - worth - found,0.975243886,FALSE
2712,local law enforcement agencies are outnumbered and outgunned. two sheriffs deputies are assigned to cannabis enforcement only one of them full time in an area larger than delaware.,2,2_arrested_police_seized_man,arrested - police - seized - man - farm - marijuana - ndlea - two - worth - found,0.650562051,FALSE
2766,"sujeto que fue detenido en #puertonatales por la brigada antinarcticos, con ms de kilos de cannabis sativa, fue formalizado y enviado a prisin preventiva. nota:",2,2_arrested_police_seized_man,arrested - police - seized - man - farm - marijuana - ndlea - two - worth - found,1,FALSE
2813,"the statement reads, in the same vein, parcels of cannabis weighing kgs concealed in sound systems (speakers) going to malabo, equatorial guinea through the sahco export shed of the airport were also seized on thursday th december by the operatives who initially arrested a",2,2_arrested_police_seized_man,arrested - police - seized - man - farm - marijuana - ndlea - two - worth - found,1,FALSE
2856,rt : seventh arrest: a yo alberton boy the latest to be charged over a horrific cbd gang rape. hes facing two counts of rape.,2,2_arrested_police_seized_man,arrested - police - seized - man - farm - marijuana - ndlea - two - worth - found,1,FALSE
2914,"incautaron cuatro bolsas repletas de marihuana en una zona de monte en san pedro en operativos de prevencin en zona rural, la polica secuestr kilogramos de cannabis sativa que estn distribuidos en cuatro bolsas arpilleras",2,2_arrested_police_seized_man,arrested - police - seized - man - farm - marijuana - ndlea - two - worth - found,1,FALSE
2954,"rt : male arrested following a stop check near the cleddau bridge this morning, for providing a positive drug wipe for cannabis an",2,2_arrested_police_seized_man,arrested - police - seized - man - farm - marijuana - ndlea - two - worth - found,1,FALSE
3086,"#cannabis #marijuana #thc #cannabiscommunity p333,000 marijuana seized in central luzon manila bulletin news / luzon / p333,000 marijuana seized in central luzon p333,000 marijuana seized in central luzon camp olivas, city of san",2,2_arrested_police_seized_man,arrested - police - seized - man - farm - marijuana - ndlea - two - worth - found,1,FALSE
3115,"rt : detectives de la brigada antinarcticos temuco incautaron $7millones de pesos, ms de mil dosis de cannabis y mil de",2,2_arrested_police_seized_man,arrested - police - seized - man - farm - marijuana - ndlea - two - worth - found,1,FALSE
3247,in a successful drive towards #neshamukttripura recovered dry cannabis weighing approx kgs from a container vehicle and arrested two persons. #tripurapolice #sevaveertabandhuta,2,2_arrested_police_seized_man,arrested - police - seized - man - farm - marijuana - ndlea - two - worth - found,0.744346515,FALSE
3341,"iraq on sunday burnt some six tons of illegal drugs including vast piles of cannabis, captagon and cocaine, in what officials said was the largest destruction for over a decade.",2,2_arrested_police_seized_man,arrested - police - seized - man - farm - marijuana - ndlea - two - worth - found,0.61810214,FALSE
3430,"five nepali nationals held for allegedly selling cannabis in kerala, india",2,2_arrested_police_seized_man,arrested - police - seized - man - farm - marijuana - ndlea - two - worth - found,0.644135358,FALSE
3537,man arrested in newry after police seize cannabis via,2,2_arrested_police_seized_man,arrested - police - seized - man - farm - marijuana - ndlea - two - worth - found,1,FALSE
3557,"#cannabiscommunity #marijuana #cannabis -year-old arrested for giving marijuana edible to student newberry county, s.c. (wspa) a -year-old was arrested monday for distributing a marijuana edible to another student. the newberry county",2,2_arrested_police_seized_man,arrested - police - seized - man - farm - marijuana - ndlea - two - worth - found,1,FALSE
3605,rt : #sapsec five male suspects were arrested in king williams town cbd today during operation vala konke for dealing in da,2,2_arrested_police_seized_man,arrested - police - seized - man - farm - marijuana - ndlea - two - worth - found,1,FALSE
3684,#cannabis #marijuana #thc #cannabiscommunity marijuana farmer wanted by several states arrested by mumbai police | mumbai news mumbai: a farmer engaged in marijuana farming on the maharashtra- madhya pradesh border and supplying it to sellers in different,2,2_arrested_police_seized_man,arrested - police - seized - man - farm - marijuana - ndlea - two - worth - found,0.817838793,FALSE
3688,rt : a drug dealer has been jailed after being found in possession of more than worth of cannabis and a knuckleduster. h,2,2_arrested_police_seized_man,arrested - police - seized - man - farm - marijuana - ndlea - two - worth - found,1,FALSE
3717,rt : detectives have arrested a -year-old man and seized suspected cannabis worth million following an operation in be,2,2_arrested_police_seized_man,arrested - police - seized - man - farm - marijuana - ndlea - two - worth - found,1,TRUE
3732,four face cannabis charges #cannabis,2,2_arrested_police_seized_man,arrested - police - seized - man - farm - marijuana - ndlea - two - worth - found,0.54695683,FALSE
3808,"earlier, local law enforcement reported about detaining the locals possessing between and grams of cannabis on multiple occasions.",2,2_arrested_police_seized_man,arrested - police - seized - man - farm - marijuana - ndlea - two - worth - found,0.674795289,FALSE
3809,"rt : earlier, local law enforcement reported about detaining the locals possessing between and grams of cannabis on multipl",2,2_arrested_police_seized_man,arrested - police - seized - man - farm - marijuana - ndlea - two - worth - found,0.864677709,FALSE
3903,cinco detenidos y cerrado un local de fumadores de cannabis en la campana (sevilla) que venda incluso a menores,2,2_arrested_police_seized_man,arrested - police - seized - man - farm - marijuana - ndlea - two - worth - found,0.57342769,FALSE
3948,rt : a man from sheffield has been jailed for yrs for shooting himself and also a man who was protecting a cannabis facto,2,2_arrested_police_seized_man,arrested - police - seized - man - farm - marijuana - ndlea - two - worth - found,0.936210326,FALSE
3965,"three people, including a -year-old boy, have been arrested following a violent robbery in the cbd. the victim was a motorbike rider and was waiting at an intersection when he was attacked. news adelaide at pm | #7news",2,2_arrested_police_seized_man,arrested - police - seized - man - farm - marijuana - ndlea - two - worth - found,1,FALSE
4155,"#cannabis #marijuana #thc #cannabiscommunity san rafael police seize pounds of marijuana, loaded gun san rafael police have arrested a man on allegations of possessing more than pounds of marijuana and a loaded .38-caliber revolver. brandon joseph",2,2_arrested_police_seized_man,arrested - police - seized - man - farm - marijuana - ndlea - two - worth - found,1,FALSE
4237,where will webber buy his weed now ? four men were arrested following the discovery of a cannabis factory at the former royston hotel in euston road in great yarmouth.,2,2_arrested_police_seized_man,arrested - police - seized - man - farm - marijuana - ndlea - two - worth - found,1,FALSE
4245,wilton cannabis factory discovery leads to three arrests,2,2_arrested_police_seized_man,arrested - police - seized - man - farm - marijuana - ndlea - two - worth - found,1,FALSE
4310,"male arrested in tenby yesterday evening, for providing a positive drug wipe for cannabis. the male declined to provide a blood sample at custody and was subsequently charged with failing to provide. he has been bailed to attend court in due course. #fatal5",2,2_arrested_police_seized_man,arrested - police - seized - man - farm - marijuana - ndlea - two - worth - found,1,FALSE
4440,rt : heres the evidence of the theft of the tank farmed cannabis while in transfer to it actually,2,2_arrested_police_seized_man,arrested - police - seized - man - farm - marijuana - ndlea - two - worth - found,1,FALSE
4448,cannabis and alleged drug dealing discovered in west bridgford house raid three men have been arrested after... read:,2,2_arrested_police_seized_man,arrested - police - seized - man - farm - marijuana - ndlea - two - worth - found,1,FALSE
4469,a pembroke man will go on trial accused of conspiring to supply cannabis.,2,2_arrested_police_seized_man,arrested - police - seized - man - farm - marijuana - ndlea - two - worth - found,1,FALSE
4490,"gran cantidad de marihuana,municiones y granadas y individuos fueron detenidos por la en la comuna de #losvilos en el er plan cannabis en la provincia del choapa. ver video :",2,2_arrested_police_seized_man,arrested - police - seized - man - farm - marijuana - ndlea - two - worth - found,0.915460492,FALSE
4522,"rt : hello , anjali's friend nidhi was arrested in agra in december while smuggling of cannabis along with two persons.",2,2_arrested_police_seized_man,arrested - police - seized - man - farm - marijuana - ndlea - two - worth - found,1,FALSE
4523,rt : deceased anjali's friend nidhi was arrested in agra in december while smuggling of cannabis along with two persons. #ka,2,2_arrested_police_seized_man,arrested - police - seized - man - farm - marijuana - ndlea - two - worth - found,1,FALSE
4599,cops seize k of cannabis at glasgow house as three peoplecharged,2,2_arrested_police_seized_man,arrested - police - seized - man - farm - marijuana - ndlea - two - worth - found,1,FALSE
4631,rt : cannabis farms were found in bradford east in,2,2_arrested_police_seized_man,arrested - police - seized - man - farm - marijuana - ndlea - two - worth - found,0.546649992,FALSE
4789,police are investigating after a large cannabis factory was found in swindon. a man in his s is currently being questioned,2,2_arrested_police_seized_man,arrested - police - seized - man - farm - marijuana - ndlea - two - worth - found,1,FALSE
4797,rt : police raid cannabis farm on slpp mp's rented land,2,2_arrested_police_seized_man,arrested - police - seized - man - farm - marijuana - ndlea - two - worth - found,1,FALSE
4854,rt : garda attached to the westmeath divisional drugs unit have seized cannabis and following the search of a re,2,2_arrested_police_seized_man,arrested - police - seized - man - farm - marijuana - ndlea - two - worth - found,1,FALSE
4865,rt : -year-old pakistani national kidnapped in the jhb cbd on tuesday. kidnappers demanded r500 . police and private security,2,2_arrested_police_seized_man,arrested - police - seized - man - farm - marijuana - ndlea - two - worth - found,1,FALSE
4904,"a further search of the -year-olds flat in great northern road uncovered another loaded handgun as well as significant quantities of cocaine and cannabis, a stab vest, and a machete.",2,2_arrested_police_seized_man,arrested - police - seized - man - farm - marijuana - ndlea - two - worth - found,1,FALSE
4979,police find cannabis farm on slpp mps land,2,2_arrested_police_seized_man,arrested - police - seized - man - farm - marijuana - ndlea - two - worth - found,1,FALSE
5044,rt : us man jailed over cannabis find at belfast city airport,2,2_arrested_police_seized_man,arrested - police - seized - man - farm - marijuana - ndlea - two - worth - found,1,FALSE
5068,three men have been jailed after police discovered thousands of pounds worth of cocaine and cannabis stashed in a tumble dryer.,2,2_arrested_police_seized_man,arrested - police - seized - man - farm - marijuana - ndlea - two - worth - found,1,FALSE
5086,rt : a teenager was arrested after police found a quantity of cannabis in his possession. one o,2,2_arrested_police_seized_man,arrested - police - seized - man - farm - marijuana - ndlea - two - worth - found,1,FALSE
5120,ndlea arrests notorious physically challenged drug dealer with kgs of cannabis inedo,2,2_arrested_police_seized_man,arrested - police - seized - man - farm - marijuana - ndlea - two - worth - found,1,FALSE
5165,rt : ndlea arrests notorous physically challenged drg dealer with kgs of cannabis in edo an alleged notorous physically,2,2_arrested_police_seized_man,arrested - police - seized - man - farm - marijuana - ndlea - two - worth - found,1,FALSE
5171,rt : a raid was conducted in one building in jhb cbd. one guy reportedly swallowed drugs for fear of being caught. he died of,2,2_arrested_police_seized_man,arrested - police - seized - man - farm - marijuana - ndlea - two - worth - found,1,FALSE
5189,rt : jhb cbd where a tanzanian alleged drug dealer was allegedly killed by police,2,2_arrested_police_seized_man,arrested - police - seized - man - farm - marijuana - ndlea - two - worth - found,0.725164893,FALSE
5297,police destroy over $11m in cannabis and cocaine - nation news,2,2_arrested_police_seized_man,arrested - police - seized - man - farm - marijuana - ndlea - two - worth - found,1,FALSE
5298,#cannabis #marijuana #thc #cannabiscommunity two men shot dead while seated in car in durban cbd police are searching for two people who shot dead two men in durban on tuesday.,2,2_arrested_police_seized_man,arrested - police - seized - man - farm - marijuana - ndlea - two - worth - found,1,FALSE
5312,"#cannabis #marijuana #thc #cannabiscommunity alleged straw owner of marijuana farm connected with quadruple murder arrested kingfisher, okla. (kfor) another arrest has been made surrounding the quadruple murder at a marijuana farm in",2,2_arrested_police_seized_man,arrested - police - seized - man - farm - marijuana - ndlea - two - worth - found,0.889392356,FALSE
5331,nigerian customs authorities seize nearly pounds of weed #cannabis,2,2_arrested_police_seized_man,arrested - police - seized - man - farm - marijuana - ndlea - two - worth - found,0.811235797,FALSE
5333,"on wednesday, /11/23, our narcotics bureau queens north executed a search warrant inside of -35 college point bvd in regard to illegal sales of cannabis and controlled substances. we recovered cannabis, psychedelic mushrooms (psylocibin) and $500 usc. perps were arrested.",2,2_arrested_police_seized_man,arrested - police - seized - man - farm - marijuana - ndlea - two - worth - found,1,FALSE
5362,"earlier today, police began filling skips with cannabis farm equipment taken from an abandoned aboyne hotel. officers raided the huntly arms hotel on monday morning. the venue has been watched over by police since then. full story: scott baxter",2,2_arrested_police_seized_man,arrested - police - seized - man - farm - marijuana - ndlea - two - worth - found,1,FALSE
5394,"police yesterday raided a home in hendon which contained a suspected cannabis firm, after receiving a tip off by locals.",2,2_arrested_police_seized_man,arrested - police - seized - man - farm - marijuana - ndlea - two - worth - found,1,FALSE
5406,customs intercepts cannabis worth n516m inlagos,2,2_arrested_police_seized_man,arrested - police - seized - man - farm - marijuana - ndlea - two - worth - found,0.807896226,FALSE
5454,"rt : ganja under burka: shabnam, madina, shahnaz and shabana arrested for smuggling cannabis inside jail under their islamic",2,2_arrested_police_seized_man,arrested - police - seized - man - farm - marijuana - ndlea - two - worth - found,1,FALSE
5506,(2/2) the search led to the officers finding a bag with a firearm that was determined to be stolen as well as ounces of cannabis packaged for sale. the occupant that was holding the bag was a -time convicted felon.,2,2_arrested_police_seized_man,arrested - police - seized - man - farm - marijuana - ndlea - two - worth - found,1,FALSE
5547,"rt : ndlea storms edo forests, razes tons cannabis warehouses, arrests . seizes $269,000 fake dollars, nabs syndicat",2,2_arrested_police_seized_man,arrested - police - seized - man - farm - marijuana - ndlea - two - worth - found,0.884810732,FALSE
5549,"ndlea storms edo forests, razes tons cannabis warehouses, arrests ...seizes $269,000 fake dollars, nabs syndicate members in joint operation with efcc in lagos - prowlingeagles",2,2_arrested_police_seized_man,arrested - police - seized - man - farm - marijuana - ndlea - two - worth - found,1,FALSE
5558,"rt : ndlea, efcc destroy cannabis warehouses, seize fake $269,000 in edo, lagos",2,2_arrested_police_seized_man,arrested - police - seized - man - farm - marijuana - ndlea - two - worth - found,0.994217275,FALSE
5595,"rt : video: ndlea storms edo forests, razes tons of cannabis warehouses, arrests",2,2_arrested_police_seized_man,arrested - police - seized - man - farm - marijuana - ndlea - two - worth - found,0.726192192,FALSE
5600,"ndlea storms edo forests, razes -ton cannabis warehouses, arrests",2,2_arrested_police_seized_man,arrested - police - seized - man - farm - marijuana - ndlea - two - worth - found,0.821913776,FALSE
5606,"rt : shabnam, madina, shahnaz, and shabana arrested in #azamgarh (#uttarpradesh) for carrying cannabis under burqa for sup",2,2_arrested_police_seized_man,arrested - police - seized - man - farm - marijuana - ndlea - two - worth - found,1,FALSE
5625,"rt : samuel caldwell, st person charged with a #cannabis offense was arrested october , , day after the marijuana ta",2,2_arrested_police_seized_man,arrested - police - seized - man - farm - marijuana - ndlea - two - worth - found,1,FALSE
5674,rt : mr mistwah abdulnasir kassim was on the other hand charged with being in possession of one sachet of cannabis sativa with,2,2_arrested_police_seized_man,arrested - police - seized - man - farm - marijuana - ndlea - two - worth - found,1,FALSE
5708,rt : the national drug law enforcement agency (ndlea) has destroyed warehouses and tents for storage of cannabis sativa also know,2,2_arrested_police_seized_man,arrested - police - seized - man - farm - marijuana - ndlea - two - worth - found,0.92869167,FALSE
