,Document,Topic,Name,Top_n_words,Probability,Representative_document
2068,"rt : #breaking at least students treated for possible cannabis overdose at van nuys middle school, officials say",11,11_children_students_accidentally_school,children - students - accidentally - school - middle - kids - edibles - overdose - nios - treated,0.622504182,FALSE
2075,"rt : at least ten students treated for possible cannabis overdose at van nuys middle school, officials say but, yeah, keep say",11,11_children_students_accidentally_school,children - students - accidentally - school - middle - kids - edibles - overdose - nios - treated,0.889504896,FALSE
2107,children treated for apparent cannabis overdose at la middle school see the full story here: #freespoke via,11,11_children_students_accidentally_school,children - students - accidentally - school - middle - kids - edibles - overdose - nios - treated,0.874538075,FALSE
2108,los angeles students appear to od on cannabis edibles,11,11_children_students_accidentally_school,children - students - accidentally - school - middle - kids - edibles - overdose - nios - treated,0.680253903,FALSE
2140,rt : la middle school students appear to overdose on edible cannabis,11,11_children_students_accidentally_school,children - students - accidentally - school - middle - kids - edibles - overdose - nios - treated,0.543179062,TRUE
2146,rt : middle-school students in la likely overdosed on cannabis edibles: report,11,11_children_students_accidentally_school,children - students - accidentally - school - middle - kids - edibles - overdose - nios - treated,0.969813266,FALSE
2154,la middle school students appear to overdose on edible cannabis,11,11_children_students_accidentally_school,children - students - accidentally - school - middle - kids - edibles - overdose - nios - treated,0.966368442,TRUE
2169,los angeles middle schoolers treated for suspected overdoses #cannabis #marijuana,11,11_children_students_accidentally_school,children - students - accidentally - school - middle - kids - edibles - overdose - nios - treated,0.923188699,FALSE
2581,"rt : i rather my kids consume cannabis than get drunk..any day of the week! since , #cannabis use in young adults has in",11,11_children_students_accidentally_school,children - students - accidentally - school - middle - kids - edibles - overdose - nios - treated,0.271906032,FALSE
2679,"#aaap2022 abcd study: prenatal exposure of cannabis correlated with middle childhood psychopathology (parapsycholotic experience, internalizing and externalizing behavior)",11,11_children_students_accidentally_school,children - students - accidentally - school - middle - kids - edibles - overdose - nios - treated,0.321424472,FALSE
2928,"put them to work, help out others. some come from broken homes, drug or alcohol fuelled households. i was in cbd today youths looked up to no good. i went over spoke to them. hit my car accidentally he said ""i'm sorry maam"". they told me schools out and they're bored.",11,11_children_students_accidentally_school,children - students - accidentally - school - middle - kids - edibles - overdose - nios - treated,0.355941589,FALSE
3144,tips for childproofing your cannabis,11,11_children_students_accidentally_school,children - students - accidentally - school - middle - kids - edibles - overdose - nios - treated,0.295057636,FALSE
3533,"the worst thing that will happen to a young person who overdoses on edibles made with real cannabis is that they will have a traumatic time. it wears off over a few hours. it doesn't cause any physical harm. note! d8-thc and any other by-product of prohibition, isn't cannabis!",11,11_children_students_accidentally_school,children - students - accidentally - school - middle - kids - edibles - overdose - nios - treated,1,FALSE
3540,rt : teen girls overdose on suspected cannabis edibles ~ #world #usa #news,11,11_children_students_accidentally_school,children - students - accidentally - school - middle - kids - edibles - overdose - nios - treated,0.913194249,FALSE
3804,"using marijuana during pregnancy can harm your babys developing brain and cause many other health- related problems. if you're thinking about becoming pregnant, it's safest to avoid cannabis use. for more information: #publichealth #sudbury #manitoulin",11,11_children_students_accidentally_school,children - students - accidentally - school - middle - kids - edibles - overdose - nios - treated,0.423386444,FALSE
4243,"#cuba: alarma en #eeuu por incremento de nios pequeos que consumieron drogas accidentalmente la exposicin de un infante al cannabis suele tener graves consecuencias. pueden enfermarse gravemente y tener problemas para caminar, sentarse o respirar",11,11_children_students_accidentally_school,children - students - accidentally - school - middle - kids - edibles - overdose - nios - treated,0.46350379,FALSE
4275,rt : our study on increasing pediatric cannabis exposures nationwide came out today. in addition to an increase in both icu,11,11_children_students_accidentally_school,children - students - accidentally - school - middle - kids - edibles - overdose - nios - treated,0.853298579,FALSE
4279,rt : el % de los casos de menores de edad que consumieron golosinas u otros comestibles con cannabis tenan entre y,11,11_children_students_accidentally_school,children - students - accidentally - school - middle - kids - edibles - overdose - nios - treated,0.365232885,FALSE
4316,kids' unintentional exposures to edible cannabis on the rise,11,11_children_students_accidentally_school,children - students - accidentally - school - middle - kids - edibles - overdose - nios - treated,0.997179186,FALSE
4330,"rt : more children accidentally eating cannabis edibles, poison data shows",11,11_children_students_accidentally_school,children - students - accidentally - school - middle - kids - edibles - overdose - nios - treated,0.903784566,FALSE
4352,sharp increase in children mistakenly eating cannabis edibles via,11,11_children_students_accidentally_school,children - students - accidentally - school - middle - kids - edibles - overdose - nios - treated,1,FALSE
4365,number of us children who accidentally ate cannabis rose by % in last five years |cannabis,11,11_children_students_accidentally_school,children - students - accidentally - school - middle - kids - edibles - overdose - nios - treated,1,FALSE
4375,aumenta drsticamente el nmero de nios que ingieren cannabis por error en #eeuu los investigadores hacen un llamado a los padres y a las autoridades a mantener este tipo de productos con #cannabis alejados de los nios. /ju,11,11_children_students_accidentally_school,children - students - accidentally - school - middle - kids - edibles - overdose - nios - treated,1,FALSE
4395,cada vez ms nios ingieren cannabis en ee.uu. un estudio publicado recientemente determin un aumento de % en el nmero de nios que ingieren cannabis de forma accidental en estados unidos (ee.uu.) en un lapso de cuatro aos. de acuerdo a la revi,11,11_children_students_accidentally_school,children - students - accidentally - school - middle - kids - edibles - overdose - nios - treated,0.602376356,FALSE
4650,"#new study: children consuming cannabis at astronomical rates because the packaging looks so yummy. products infused with cannabis are in packaging that looks like doritos, nerds, fritos, and gummy bears. child accidentally exposed? -800-222-1222.",11,11_children_students_accidentally_school,children - students - accidentally - school - middle - kids - edibles - overdose - nios - treated,1,FALSE
4802,parents should lock up the edibles or get locked up when their child gets poisoned. kids are accidentally ingesting cannabis products at an increased rate,11,11_children_students_accidentally_school,children - students - accidentally - school - middle - kids - edibles - overdose - nios - treated,1,FALSE
4859,"rt : my topic - ""impact of screening, brief intervention and referral to treatment on cannabis consumption for school-goin",11,11_children_students_accidentally_school,children - students - accidentally - school - middle - kids - edibles - overdose - nios - treated,0.33248787,FALSE
4991,rt : more contradictory evidence! best to still advise caution: maternal cannabis use in pregnancy and child neurodevelopm,11,11_children_students_accidentally_school,children - students - accidentally - school - middle - kids - edibles - overdose - nios - treated,0.362974322,FALSE
5035,number of young children who accidentally ate cannabis edibles ... - cnn: number of young children who accidentally ate cannabis edibles ...cnn,11,11_children_students_accidentally_school,children - students - accidentally - school - middle - kids - edibles - overdose - nios - treated,0.990384857,TRUE
5113,but the thinks cannabis edibles are more dangerous to children,11,11_children_students_accidentally_school,children - students - accidentally - school - middle - kids - edibles - overdose - nios - treated,0.908984143,FALSE
5207,rt : teen caught with cannabis in hostel a -year old namibian learner who is a grade pupil at ndiyona combined school was a,11,11_children_students_accidentally_school,children - students - accidentally - school - middle - kids - edibles - overdose - nios - treated,0.777416464,FALSE
5320,rt : #thc potency has increased substantially in #cannabis. this new study suggests that such high dose adolescent exposure incre,11,11_children_students_accidentally_school,children - students - accidentally - school - middle - kids - edibles - overdose - nios - treated,0.888862349,FALSE
5701,"rt : cannabis can be poisonous to children, even in small amounts. lock up cannabis just like you lock up your medications an",11,11_children_students_accidentally_school,children - students - accidentally - school - middle - kids - edibles - overdose - nios - treated,0.325271054,FALSE
5732,#research #study reveals % spike in direct exposures to edible #marijuana in younger kids #analysis #cannabis #children #delta #edibles #facebook #instagram #legalization #pot #variety,11,11_children_students_accidentally_school,children - students - accidentally - school - middle - kids - edibles - overdose - nios - treated,1,FALSE
5742,be aware suspicious package drug scam a number of international students living in pbsas have recently been targeted by a scam involving inadvertently accepting packages on behalf of other people which contain large quantities of cannabis. info,11,11_children_students_accidentally_school,children - students - accidentally - school - middle - kids - edibles - overdose - nios - treated,0.622504182,FALSE
5815,these adult children are all working in car washes cannabis farms etc not far to look really,11,11_children_students_accidentally_school,children - students - accidentally - school - middle - kids - edibles - overdose - nios - treated,0.460642456,FALSE
5836,but might protect more children?canadas crackdown on some cannabis extracts could cost industry millions via,11,11_children_students_accidentally_school,children - students - accidentally - school - middle - kids - edibles - overdose - nios - treated,0.439101424,FALSE
5875,rt : nitrous oxide has become the most commonly misused drug among to -year-olds in england after cannabis and there are,11,11_children_students_accidentally_school,children - students - accidentally - school - middle - kids - edibles - overdose - nios - treated,0.387518767,FALSE
6050,"cannabis most commonly used among teens in kerala, says report by excise - deccan herald",11,11_children_students_accidentally_school,children - students - accidentally - school - middle - kids - edibles - overdose - nios - treated,0.390078975,FALSE
6197,an alarming rise in our youngest children ingesting cannabis candies | nature's real health,11,11_children_students_accidentally_school,children - students - accidentally - school - middle - kids - edibles - overdose - nios - treated,1,FALSE
6531,high school kid was found using cannabis,11,11_children_students_accidentally_school,children - students - accidentally - school - middle - kids - edibles - overdose - nios - treated,0.672495902,FALSE
6607,new blog post! how to reduce the risk of your kid getting into your cannabis. read now:,11,11_children_students_accidentally_school,children - students - accidentally - school - middle - kids - edibles - overdose - nios - treated,0.390449672,FALSE
7114,"keep vapes out of sight of children in shops, say councils - bbc #vapes #vapor #vaporize #smokers #smoke #eliquids #vapepens",11,11_children_students_accidentally_school,children - students - accidentally - school - middle - kids - edibles - overdose - nios - treated,0.269887591,FALSE
7277,"heres what you need to know. if your kid eats edibles, everything will be fine. theyll have a good story to tell their friends and you as the parent have a teachable and learning moment. teach your kid what an edible is and learn not to leave them out. cannabis isnt lethal.",11,11_children_students_accidentally_school,children - students - accidentally - school - middle - kids - edibles - overdose - nios - treated,1,FALSE
7870,rt : la cantidad de chicos menores de que leen a susana gmez deberan saber que el consumo pesado (diario) de cannabis aument,11,11_children_students_accidentally_school,children - students - accidentally - school - middle - kids - edibles - overdose - nios - treated,0.661529209,FALSE
7938,"rt : cannabis products can look like a treat to your kids! if you have edibles at home, follow these steps to keep your children",11,11_children_students_accidentally_school,children - students - accidentally - school - middle - kids - edibles - overdose - nios - treated,0.903352105,FALSE
8079,"poison control, dispensaries on alert as kids who accidentally eat marijuana edibles rises - azpm #cannabis",11,11_children_students_accidentally_school,children - students - accidentally - school - middle - kids - edibles - overdose - nios - treated,1,FALSE
8297,"rt : cannabis gummies and candies are not for kids, not for anyone.",11,11_children_students_accidentally_school,children - students - accidentally - school - middle - kids - edibles - overdose - nios - treated,0.492042014,FALSE
8734,student hospitalized after group ate cannabis-infused chocolate bar in school -,11,11_children_students_accidentally_school,children - students - accidentally - school - middle - kids - edibles - overdose - nios - treated,0.876124739,FALSE
225,gummies mg #gummies #cbd #canabis #uk #london #psychedelics #nft #javascript #trip #high #yummy #mentalhealth #liverpool #england #scotland #wales,12,12_gummies_gummy_mg_cbd,gummies - gummy - mg - cbd - bears - natural - yum - infused - edibles - male,0.996345093,FALSE
444,provacan cbd gummies | {update} reviews uk must read &amp; buy now,12,12_gummies_gummy_mg_cbd,gummies - gummy - mg - cbd - bears - natural - yum - infused - edibles - male,0.8867084,FALSE
552,rt : check out cbd hemp relaxation syrup oz. mg (fruit punch flavor) #ebay via bat,12,12_gummies_gummy_mg_cbd,gummies - gummy - mg - cbd - bears - natural - yum - infused - edibles - male,0.765475934,FALSE
716,"if you are constantly struggling with stress, essential cbd gummies in south africa can do wonders for your mental health. here, you will find a comprehensive assortment of products that will help you make your health better. #healthcare #cbd #gummies #stressrelief",12,12_gummies_gummy_mg_cbd,gummies - gummy - mg - cbd - bears - natural - yum - infused - edibles - male,0.887729117,FALSE
1013,rt : #thc #cbdhealth #cannabiscommunity yum yum gummies #cbd isolate apple rings. use natural cbd #hemp oil and deliver y,12,12_gummies_gummy_mg_cbd,gummies - gummy - mg - cbd - bears - natural - yum - infused - edibles - male,0.765475934,FALSE
1247,i need to invest in cbd gummies,12,12_gummies_gummy_mg_cbd,gummies - gummy - mg - cbd - bears - natural - yum - infused - edibles - male,0.770371544,FALSE
1323,b'laster -cbd powerful citrus based degreaser - -ounces r9wuhax,12,12_gummies_gummy_mg_cbd,gummies - gummy - mg - cbd - bears - natural - yum - infused - edibles - male,0.765475934,FALSE
1358,friends of mine have told me they take cbd gummies.,12,12_gummies_gummy_mg_cbd,gummies - gummy - mg - cbd - bears - natural - yum - infused - edibles - male,0.887729117,FALSE
1731,rt : #edibles #cbdoil #cannabiscommunity american #hemp oil assorted mg #cbd gummies provide users with a great way to int,12,12_gummies_gummy_mg_cbd,gummies - gummy - mg - cbd - bears - natural - yum - infused - edibles - male,0.764574068,FALSE
2700,bevital cbd gummies should have a place in every bedroom #cbdgummies #menbooster #maleenhancementpills #maleenhancementsupplement #menopause #menbooster #redboostofficialwebsite,12,12_gummies_gummy_mg_cbd,gummies - gummy - mg - cbd - bears - natural - yum - infused - edibles - male,0.952005233,FALSE
3132,"maybe so, what ailments were you using cbd gummies for?",12,12_gummies_gummy_mg_cbd,gummies - gummy - mg - cbd - bears - natural - yum - infused - edibles - male,0.793696557,FALSE
3487,"#thc #cbdhealth #cannabiscommunity chill gummies #cbd infused gummy bearsare natural, thc free edibles sourced from industrial hemp. a popular and convenient way to get quality cbd, these premium cbd gummy bears are both delicious and #hemp #cbdoil",12,12_gummies_gummy_mg_cbd,gummies - gummy - mg - cbd - bears - natural - yum - infused - edibles - male,1,FALSE
3609,"pues para las molestias corporales y la tos, me ayud mucho el cbd, creo que tambin los ts de jengibre con limn y miel y mantener calientito mi pechito . abracito para que pase pronto.",12,12_gummies_gummy_mg_cbd,gummies - gummy - mg - cbd - bears - natural - yum - infused - edibles - male,0.7962381,FALSE
3617,pelican cbd male enhancement gummies these chewy candies were made to further develop erectile joy utilizing normal substances and are reasonable for all clients. official web- official facebook page-,12,12_gummies_gummy_mg_cbd,gummies - gummy - mg - cbd - bears - natural - yum - infused - edibles - male,0.746394011,FALSE
3619,rt : #cannabiscommunity #marijuana #cannabis truman cbd male enhancement gummies review do not buy until reading this! truman male enhancement gummies is a male enhancement supplement that uses cbd to improve the users sex driv,12,12_gummies_gummy_mg_cbd,gummies - gummy - mg - cbd - bears - natural - yum - infused - edibles - male,1,FALSE
3659,i wish the gummies were veggie so it would have to be the cbd oil!,12,12_gummies_gummy_mg_cbd,gummies - gummy - mg - cbd - bears - natural - yum - infused - edibles - male,0.745280211,FALSE
3709,"robin roberts cbd gummies reviews the robin roberts cbd gummies device regulates yearning, rest, intellectual potential, and irritation. read more: -",12,12_gummies_gummy_mg_cbd,gummies - gummy - mg - cbd - bears - natural - yum - infused - edibles - male,0.792941372,FALSE
4438,good lawd disco dabs sweet tooth terps4.82$ cbd % thc $ live resin cured resin,12,12_gummies_gummy_mg_cbd,gummies - gummy - mg - cbd - bears - natural - yum - infused - edibles - male,0.848415429,FALSE
4547,rt : #thc #cbdhealth #cannabiscommunity are you thinking of trying #cbd gummies well read on and find out the complete fa,12,12_gummies_gummy_mg_cbd,gummies - gummy - mg - cbd - bears - natural - yum - infused - edibles - male,0.78095453,FALSE
4565,rt : when the cbd gummy laced with fear toxin hits before my shift at waynetech,12,12_gummies_gummy_mg_cbd,gummies - gummy - mg - cbd - bears - natural - yum - infused - edibles - male,0.785724184,FALSE
4568,rt : #thc #cbdhealth #cannabiscommunity cbd full spectrum sour bear gummies. yum yum gummies mg full spectrum #cbd in,12,12_gummies_gummy_mg_cbd,gummies - gummy - mg - cbd - bears - natural - yum - infused - edibles - male,1,FALSE
4655,jolly cbd gummies is one such product that will enable its consumers to become healthy and fit . it comes in the form of small gummies that are easy to consume. #jollycbdgummies #jollycbd #cbd #cbdgummies #purecbd,12,12_gummies_gummy_mg_cbd,gummies - gummy - mg - cbd - bears - natural - yum - infused - edibles - male,1,FALSE
4754,"took your advice and ordered a couple of bottles. i tried cbd gummies but, sadly, they give me bowel problems. thank you soooo much for your suggestion. big hugs from this anxious old woman.",12,12_gummies_gummy_mg_cbd,gummies - gummy - mg - cbd - bears - natural - yum - infused - edibles - male,0.880765036,FALSE
4946,#edibles #cbdoil #cannabiscommunity yum yum sour gummies #cbd x cbd infused sour bears. use natural cbd #hemp extract and deliver yummy cbd gummy taste. cbd gummies are the #1 cbd choice for many people wanting to take cbd oil (cannabidiol). #cannabis,12,12_gummies_gummy_mg_cbd,gummies - gummy - mg - cbd - bears - natural - yum - infused - edibles - male,0.778438616,FALSE
5036,sweet relief cbd gummies include mg of natural cbd oil extract. #sweetreliefcbdgummies #sweetreliefcbdgummiesreview,12,12_gummies_gummy_mg_cbd,gummies - gummy - mg - cbd - bears - natural - yum - infused - edibles - male,1,FALSE
5074,i need some more cbd gummies,12,12_gummies_gummy_mg_cbd,gummies - gummy - mg - cbd - bears - natural - yum - infused - edibles - male,0.840165213,FALSE
5339,i took a cbd gummy before work today and im in a great mood,12,12_gummies_gummy_mg_cbd,gummies - gummy - mg - cbd - bears - natural - yum - infused - edibles - male,0.887729117,FALSE
5432,"rt : #thc #cbdhealth #cannabiscommunity relax gummies cbdfull spectrumgummy bears mg are natural, thc free #cbd edi",12,12_gummies_gummy_mg_cbd,gummies - gummy - mg - cbd - bears - natural - yum - infused - edibles - male,1,FALSE
5622,tell me more about the cbd gummies,12,12_gummies_gummy_mg_cbd,gummies - gummy - mg - cbd - bears - natural - yum - infused - edibles - male,0.842073379,FALSE
5623,get the natural support you need with our cbd gummies - a delicious way to supplement cbd. buy now! #yogihealth #yogihealthproducts #yogihealthplus #cbdhealth #broadspectrumcbd #cbdcream #cbdcures #cbdhealth #cbdjourney #cbdlife,12,12_gummies_gummy_mg_cbd,gummies - gummy - mg - cbd - bears - natural - yum - infused - edibles - male,0.78277965,FALSE
6162,gonna take cbd gummy bears later to hopefully calm my stress for my hospital appointment today hahaha i don't wanna go,12,12_gummies_gummy_mg_cbd,gummies - gummy - mg - cbd - bears - natural - yum - infused - edibles - male,0.887729117,FALSE
6346,"rt : life can be stressful. bills, the cost of food going way up, life in general. maximum potency cbd gummies from",12,12_gummies_gummy_mg_cbd,gummies - gummy - mg - cbd - bears - natural - yum - infused - edibles - male,0.801420801,FALSE
6621,broad spectrum cbd gummy supplements can be used when you usually feel anxious or stressed out. read more #cbd #cbdgummies #premiumcbdgummies #cbdgummies #purecbdoil,12,12_gummies_gummy_mg_cbd,gummies - gummy - mg - cbd - bears - natural - yum - infused - edibles - male,0.868972561,FALSE
6669,bought cbd gummies today that were very likely a scam and i just took one. i will keep u all updated,12,12_gummies_gummy_mg_cbd,gummies - gummy - mg - cbd - bears - natural - yum - infused - edibles - male,0.757032917,FALSE
6749,rt : retweet and comment if youve tried these cbd gummy bears before bed they are honestly magic from leave a comme,12,12_gummies_gummy_mg_cbd,gummies - gummy - mg - cbd - bears - natural - yum - infused - edibles - male,0.993525796,FALSE
6780,"#a+ #cbd #gummies a+ cbd gummies are a high-tech, full-spectrum treatment for people who want to get better from both mental and physical problems.",12,12_gummies_gummy_mg_cbd,gummies - gummy - mg - cbd - bears - natural - yum - infused - edibles - male,0.952005233,FALSE
6949,"rt : sweets dont do anything no, but these are gummies, infused with our high quality cbd, thats what helps so",12,12_gummies_gummy_mg_cbd,gummies - gummy - mg - cbd - bears - natural - yum - infused - edibles - male,0.822765963,FALSE
6964,"we can all use a little help recovering after long and stressful days. maxxam has made it easy with their ""recovery"" gummies! with a delicious fruit punch flavor, each chew has mg of hemp-derived cbd and mg of cbg! save % with code ""edibles15"" at",12,12_gummies_gummy_mg_cbd,gummies - gummy - mg - cbd - bears - natural - yum - infused - edibles - male,0.804303104,FALSE
7218,((be careful))- does animale cbd gummies work? animale cbd male enhancem... via,12,12_gummies_gummy_mg_cbd,gummies - gummy - mg - cbd - bears - natural - yum - infused - edibles - male,0.927733181,FALSE
7249,rt : i havent had covid (yet?) i do nasal irrigation (sometimes w/cbd in the mi,12,12_gummies_gummy_mg_cbd,gummies - gummy - mg - cbd - bears - natural - yum - infused - edibles - male,0.78241743,FALSE
7444,got sick of being screamed at and took some cbd/thc gummies while working,12,12_gummies_gummy_mg_cbd,gummies - gummy - mg - cbd - bears - natural - yum - infused - edibles - male,0.81136488,FALSE
7484,"hardx cbd gummies main benefits improved blood flow, promotes better erections, improves energy one month program price - $69.97. visit: #energy #gummies #maleenhancement #buy #official",12,12_gummies_gummy_mg_cbd,gummies - gummy - mg - cbd - bears - natural - yum - infused - edibles - male,0.820701586,FALSE
7485,"cbd gummies hemp extract [scam exposed, shark tank] pure organic hemp ... - outlook india cbd gummies hemp extract are a type of cbd edibles, made with cbd isolate. these all-natural gummies come in a variety of flavors such as mango,...",12,12_gummies_gummy_mg_cbd,gummies - gummy - mg - cbd - bears - natural - yum - infused - edibles - male,1,FALSE
7686,"rt : #edibles #cbdoil #cannabiscommunity relax gummies #cbd full spectrum gummy bears mg are natural, thc free cbd edible",12,12_gummies_gummy_mg_cbd,gummies - gummy - mg - cbd - bears - natural - yum - infused - edibles - male,1,FALSE
