,Document,Topic,Name,Top_n_words,Probability,Representative_document
5965,"#aphox es tu mejor aliado para el control de plagas de #pulgn en tus cultivos hortcolas no permitas que las plagas afecten tu produccin, aplica aphox en cualquier momento del ao para unos cultivos libres de pulgn gracias a su efecto vapor",5,5_weed_cannabiscommunity_thc_weedlife,weed - cannabiscommunity - thc - weedlife - og - 420 - marijuana - weedsmokers - weedmemes - kush,0.896407325,FALSE
6091,rt : posted by u/madgirafe /2 double grape and forum stomper #cannabis,5,5_weed_cannabiscommunity_thc_weedlife,weed - cannabiscommunity - thc - weedlife - og - 420 - marijuana - weedsmokers - weedmemes - kush,0.794328677,FALSE
6215,id : ..5 &gt; # # #og # # # # # #thaiweed #thaicannabis #thaimarihuana # #weed #cannabis,5,5_weed_cannabiscommunity_thc_weedlife,weed - cannabiscommunity - thc - weedlife - og - 420 - marijuana - weedsmokers - weedmemes - kush,1,FALSE
6453,# #marihuana # # # #weed #cannabis # #thaistick #weedsmokers # # #weed,5,5_weed_cannabiscommunity_thc_weedlife,weed - cannabiscommunity - thc - weedlife - og - 420 - marijuana - weedsmokers - weedmemes - kush,1,FALSE
6488,rt : #cannabis #weedmemes,5,5_weed_cannabiscommunity_thc_weedlife,weed - cannabiscommunity - thc - weedlife - og - 420 - marijuana - weedsmokers - weedmemes - kush,0.90385177,FALSE
6513,what do you think about this? #weed #cannabis #cannabiscommunity,5,5_weed_cannabiscommunity_thc_weedlife,weed - cannabiscommunity - thc - weedlife - og - 420 - marijuana - weedsmokers - weedmemes - kush,0.986402684,FALSE
6542,where the weed telegram #weed #cannabis,5,5_weed_cannabiscommunity_thc_weedlife,weed - cannabiscommunity - thc - weedlife - og - 420 - marijuana - weedsmokers - weedmemes - kush,0.803402218,TRUE
6807,rt : lb.$900 #weedmob #weed #weedlife #weedlover #weedcommunity #smokeweed #smoke #mmemberville #cbd #stonerfam #420community,5,5_weed_cannabiscommunity_thc_weedlife,weed - cannabiscommunity - thc - weedlife - og - 420 - marijuana - weedsmokers - weedmemes - kush,0.653784369,FALSE
6934,shit beuh weed dispo via snap: telegram: . #psychedelic #dmt #weed #shrooms #mushroom #marijuana #cannabis #weed #cannabiscommunity #thc #weed,5,5_weed_cannabiscommunity_thc_weedlife,weed - cannabiscommunity - thc - weedlife - og - 420 - marijuana - weedsmokers - weedmemes - kush,0.592910445,TRUE
7007,"blue dream x sour diesel /g /g /g :fruity , sweet, sour # # # # # # #cannabis #thaicanabis #weed #420life #",5,5_weed_cannabiscommunity_thc_weedlife,weed - cannabiscommunity - thc - weedlife - og - 420 - marijuana - weedsmokers - weedmemes - kush,0.642731542,FALSE
7156,baby #jeeter infused - horchata pack indica #prerolls #cannabis #oxnard,5,5_weed_cannabiscommunity_thc_weedlife,weed - cannabiscommunity - thc - weedlife - og - 420 - marijuana - weedsmokers - weedmemes - kush,0.777658156,FALSE
7287,"kick off your day like a boss with #t420g! elevate your #bosslife and take a hit of our premium, handcrafted glassware from . don't settle for less, #bossup and shop now: #cannabis #marijuana #sativalife",5,5_weed_cannabiscommunity_thc_weedlife,weed - cannabiscommunity - thc - weedlife - og - 420 - marijuana - weedsmokers - weedmemes - kush,1,FALSE
7292,frosty one #weedgirl #cannabis #420community,5,5_weed_cannabiscommunity_thc_weedlife,weed - cannabiscommunity - thc - weedlife - og - 420 - marijuana - weedsmokers - weedmemes - kush,0.714864358,FALSE
7332,"# , (cannabis sommelier) . . (weed expert) .",5,5_weed_cannabiscommunity_thc_weedlife,weed - cannabiscommunity - thc - weedlife - og - 420 - marijuana - weedsmokers - weedmemes - kush,1,FALSE
7381,rt : #mmemberville i am once again asking you to smoke another bowl #cannabis #cannabislife #cannabiscommunity #cannabiscul,5,5_weed_cannabiscommunity_thc_weedlife,weed - cannabiscommunity - thc - weedlife - og - 420 - marijuana - weedsmokers - weedmemes - kush,1,FALSE
7382,rt : a large harvest #cannabis #stonerfam #legalizeit #weedmob #cbd,5,5_weed_cannabiscommunity_thc_weedlife,weed - cannabiscommunity - thc - weedlife - og - 420 - marijuana - weedsmokers - weedmemes - kush,0.61460976,FALSE
7480,mimosa evo indoor g. .- oz. .- g. .- g -: plugstar420 #weed #cannabis #thc # # #og # # # # # #,5,5_weed_cannabiscommunity_thc_weedlife,weed - cannabiscommunity - thc - weedlife - og - 420 - marijuana - weedsmokers - weedmemes - kush,0.68400289,FALSE
7575,rt : #cannabiscommunity #cannabis #weed #weedmemes,5,5_weed_cannabiscommunity_thc_weedlife,weed - cannabiscommunity - thc - weedlife - og - 420 - marijuana - weedsmokers - weedmemes - kush,0.991552263,FALSE
8045,rt : always two friend #mmemberville #stonerfam #weedmob #cannabisculture #weed #cannabis #legalizeit,5,5_weed_cannabiscommunity_thc_weedlife,weed - cannabiscommunity - thc - weedlife - og - 420 - marijuana - weedsmokers - weedmemes - kush,0.98257904,FALSE
8255,rt : retweet if you would #smoke with me and #smokefetish #hotgirlssmoking #bigtittygothgf #cannabis #smoking,5,5_weed_cannabiscommunity_thc_weedlife,weed - cannabiscommunity - thc - weedlife - og - 420 - marijuana - weedsmokers - weedmemes - kush,1,FALSE
8267,rt : ever wondered how thc affects pre natal devt? read on. #cannabis #cannabiscommunity #weed #marijuana #thc #cbd #cannabi,5,5_weed_cannabiscommunity_thc_weedlife,weed - cannabiscommunity - thc - weedlife - og - 420 - marijuana - weedsmokers - weedmemes - kush,0.898039076,FALSE
8304,# # #marijuana #marihuana # # # #weed #cannabis # #thaistick #weedsmokers # #,5,5_weed_cannabiscommunity_thc_weedlife,weed - cannabiscommunity - thc - weedlife - og - 420 - marijuana - weedsmokers - weedmemes - kush,0.789273391,FALSE
8336,rt : makes a lot of sense to us #cannabis #cannabiscommunity #weed #marijuana #thc #cbd #cannabisculture,5,5_weed_cannabiscommunity_thc_weedlife,weed - cannabiscommunity - thc - weedlife - og - 420 - marijuana - weedsmokers - weedmemes - kush,1,FALSE
8424,rt : lb.$900 #weedmob #weed #weedlife #weedlover #weedcommunity #smokeweed #smoke #mmemberville #cbd #stonerfam #420commun,5,5_weed_cannabiscommunity_thc_weedlife,weed - cannabiscommunity - thc - weedlife - og - 420 - marijuana - weedsmokers - weedmemes - kush,0.635907444,FALSE
8427,""" aluminium grinder with clear top, best gifts, black and blue via #grinder #grinders #herbgrinder #herbgrinders #mmj #mmjlife #weed #cannabis #cannabislover #mmjlover #marijuana #marijuanalovers #420life #weedlife",5,5_weed_cannabiscommunity_thc_weedlife,weed - cannabiscommunity - thc - weedlife - og - 420 - marijuana - weedsmokers - weedmemes - kush,0.617683199,FALSE
8474,"cybertela women's four marijuana weed juniors t-shirt (pink, small) via #mmj #420life #cannabis #marijuana #cannabisclothing #mmjclothing #ganja #weed #cannabisculture #cannabiscommunity #420love #tokers #weedlife",5,5_weed_cannabiscommunity_thc_weedlife,weed - cannabiscommunity - thc - weedlife - og - 420 - marijuana - weedsmokers - weedmemes - kush,0.892663214,FALSE
8667,anyone ever been to a #cannabis farm ?,5,5_weed_cannabiscommunity_thc_weedlife,weed - cannabiscommunity - thc - weedlife - og - 420 - marijuana - weedsmokers - weedmemes - kush,0.594754791,FALSE
8690,"rt : great...bees, weed....loads of fun good things....honey.... #cannabis #cannabiscommunity #weed #marijuana #thc #cbd #c",5,5_weed_cannabiscommunity_thc_weedlife,weed - cannabiscommunity - thc - weedlife - og - 420 - marijuana - weedsmokers - weedmemes - kush,0.636110507,FALSE
8691,rt : well that nails one urban myth dont ya think? #cannabis #cannabiscommunity #weed #marijuana #thc #cbd #cannabisculture,5,5_weed_cannabiscommunity_thc_weedlife,weed - cannabiscommunity - thc - weedlife - og - 420 - marijuana - weedsmokers - weedmemes - kush,1,FALSE
8711,rt : #hush #hushvape #davis #davisca #cannacommunity #vibes #smoke #gummies #edibles #thc #cbd #weedstagram #olivedrive #420 #k,5,5_weed_cannabiscommunity_thc_weedlife,weed - cannabiscommunity - thc - weedlife - og - 420 - marijuana - weedsmokers - weedmemes - kush,0.596776067,FALSE
8763,rt : #weed #cannabis #cannabisoil #cannabisoils #thc #edibles #edible #cbdoils #cbdoil #cbdbuds #cb,5,5_weed_cannabiscommunity_thc_weedlife,weed - cannabiscommunity - thc - weedlife - og - 420 - marijuana - weedsmokers - weedmemes - kush,0.638015789,FALSE
8774,"rt : #__ ram's true color, there is also such a holi which does not require dancing, singing, cannabis, drugs an",5,5_weed_cannabiscommunity_thc_weedlife,weed - cannabiscommunity - thc - weedlife - og - 420 - marijuana - weedsmokers - weedmemes - kush,0.697517056,FALSE
131,rt : can the elderly use cbd oil? laweekly,6,6_oil_oils_cbd_mg,oil - oils - cbd - mg - effective - try - cbdoil - cbdhealth - thc - hemp,0.223210623,FALSE
190,"i love the cbd, but the lavender is a bonus! it is a little greasy.",6,6_oil_oils_cbd_mg,oil - oils - cbd - mg - effective - try - cbdoil - cbdhealth - thc - hemp,0.159341112,FALSE
285,"the burnout is real! we all feel it everyday. at eunoia we are building the bridge between body, mind and online. unplug with our limited edition full spectrum oil with mg of cbd. receive % with launch code unplug",6,6_oil_oils_cbd_mg,oil - oils - cbd - mg - effective - try - cbdoil - cbdhealth - thc - hemp,0.255648317,FALSE
290,bogo deals on our cbd oils and beauty products but only for a limited time!!! get yours today! / link in bio #cbdoil #hemp #cbdlife #discount #cbdproducts #deal #sale #cannabis #hempcbd #cbdhealth #cbdcommunity #bogo,6,6_oil_oils_cbd_mg,oil - oils - cbd - mg - effective - try - cbdoil - cbdhealth - thc - hemp,0.217523138,FALSE
346,raw cbd oil worked for me,6,6_oil_oils_cbd_mg,oil - oils - cbd - mg - effective - try - cbdoil - cbdhealth - thc - hemp,0.699240697,FALSE
468,"gotta heat up weed and hemp to active the thc and cbd for use, when making oils and edibles",6,6_oil_oils_cbd_mg,oil - oils - cbd - mg - effective - try - cbdoil - cbdhealth - thc - hemp,0.879717267,FALSE
537,big deals! oil alpreleaf serenity % cbd (10 ml) only at on hurry. #cosmetics #beauty,6,6_oil_oils_cbd_mg,oil - oils - cbd - mg - effective - try - cbdoil - cbdhealth - thc - hemp,0.243923141,FALSE
543,cbd oil helps me stay relaxed take care,6,6_oil_oils_cbd_mg,oil - oils - cbd - mg - effective - try - cbdoil - cbdhealth - thc - hemp,0.247620368,FALSE
548,rt : it's /11 make a wish! i wish everyone had access to cbd oil! blood pressure has reduced (146 down to ) to a normal,6,6_oil_oils_cbd_mg,oil - oils - cbd - mg - effective - try - cbdoil - cbdhealth - thc - hemp,0.496173922,FALSE
689,cbd oil works great!,6,6_oil_oils_cbd_mg,oil - oils - cbd - mg - effective - try - cbdoil - cbdhealth - thc - hemp,0.644299193,FALSE
773,kairyssdal too much cbd oil in their pumpkin spice ipa?,6,6_oil_oils_cbd_mg,oil - oils - cbd - mg - effective - try - cbdoil - cbdhealth - thc - hemp,0.725973874,FALSE
829,"retro post: cbd oil (cannabidiol) what is it, and should i buy it? by dr kathleen thompson",6,6_oil_oils_cbd_mg,oil - oils - cbd - mg - effective - try - cbdoil - cbdhealth - thc - hemp,1,FALSE
895,dallas wrr is moving to all-classical format. will ads for cbd oils go away?,6,6_oil_oils_cbd_mg,oil - oils - cbd - mg - effective - try - cbdoil - cbdhealth - thc - hemp,0.232403962,FALSE
1136,"i&amp;#039;ve tried a lot of cbd oils, but i keep coming back to this one #natural",6,6_oil_oils_cbd_mg,oil - oils - cbd - mg - effective - try - cbdoil - cbdhealth - thc - hemp,0.821073689,FALSE
1149,can i use something other than weed? it's illegal here you know. can i use the name of my cbd oil?,6,6_oil_oils_cbd_mg,oil - oils - cbd - mg - effective - try - cbdoil - cbdhealth - thc - hemp,1,FALSE
1164,rt : jesus christ my whole audience is gonna be rolling on cbd oil its gonna feel like a barnes and noble,6,6_oil_oils_cbd_mg,oil - oils - cbd - mg - effective - try - cbdoil - cbdhealth - thc - hemp,0.190696698,FALSE
1260,"the cbd oil c8 mct ml (1,500mg) #mct c8 mctcbd #thecbd no.1 #cbd #thecbd",6,6_oil_oils_cbd_mg,oil - oils - cbd - mg - effective - try - cbdoil - cbdhealth - thc - hemp,0.303080325,FALSE
1618,rt : i heard gareth southgate has cbd oil in his bag,6,6_oil_oils_cbd_mg,oil - oils - cbd - mg - effective - try - cbdoil - cbdhealth - thc - hemp,0.432989652,FALSE
1678,! thc .. cbd oil stress .. !,6,6_oil_oils_cbd_mg,oil - oils - cbd - mg - effective - try - cbdoil - cbdhealth - thc - hemp,0.496670104,FALSE
1716,i am thinking this could be a good option for me. dont want to buy illegally etc but cannot afford cbd oil etc from pharmacy.,6,6_oil_oils_cbd_mg,oil - oils - cbd - mg - effective - try - cbdoil - cbdhealth - thc - hemp,0.673143271,FALSE
1874,how much is supreme cbd oil mg,6,6_oil_oils_cbd_mg,oil - oils - cbd - mg - effective - try - cbdoil - cbdhealth - thc - hemp,0.575066487,FALSE
1907,all of them are charging stupid money the oils they use are % thc and % cbd oil from bedrocan,6,6_oil_oils_cbd_mg,oil - oils - cbd - mg - effective - try - cbdoil - cbdhealth - thc - hemp,0.317791675,FALSE
1915,the latest the cbd oil daily! thanks to #cbd #cannabis,6,6_oil_oils_cbd_mg,oil - oils - cbd - mg - effective - try - cbdoil - cbdhealth - thc - hemp,0.927513904,FALSE
1925,lmfaoooo my mum used cbd oil. our goal is to give her an edible the next time shes here. she was very interested,6,6_oil_oils_cbd_mg,oil - oils - cbd - mg - effective - try - cbdoil - cbdhealth - thc - hemp,0.564839742,FALSE
2077,"#thc #cbdhealth #cannabiscommunity using #cbd oil that is safe is something that is of the outmost importance. cbd oil is quickly becoming one of the most popular new products on the market. in reality, yearly sales of cbd oil products were about #cbdoil",6,6_oil_oils_cbd_mg,oil - oils - cbd - mg - effective - try - cbdoil - cbdhealth - thc - hemp,0.729885375,FALSE
2111,cbd or smoke 's hmm..essential oils...,6,6_oil_oils_cbd_mg,oil - oils - cbd - mg - effective - try - cbdoil - cbdhealth - thc - hemp,0.700680773,FALSE
2134,"rt : cbd can be transformed as oil and be infused in almost all kinds of foods, drinks, dietary supplements, capsules, and",6,6_oil_oils_cbd_mg,oil - oils - cbd - mg - effective - try - cbdoil - cbdhealth - thc - hemp,0.437132484,FALSE
2212,im laughing right now holy!!!! im sorry cbd oil finally hit me,6,6_oil_oils_cbd_mg,oil - oils - cbd - mg - effective - try - cbdoil - cbdhealth - thc - hemp,0.391818418,FALSE
2266,"rt : retweet this plz peopleive always had amazing feedback from anyone whos tried my cbd oil, if you want to give it a go cl",6,6_oil_oils_cbd_mg,oil - oils - cbd - mg - effective - try - cbdoil - cbdhealth - thc - hemp,0.536960045,FALSE
2337,where and how to buy cbd and hemp oil online icd35gi,6,6_oil_oils_cbd_mg,oil - oils - cbd - mg - effective - try - cbdoil - cbdhealth - thc - hemp,1,FALSE
2345,cbd oil is your friend. research it.,6,6_oil_oils_cbd_mg,oil - oils - cbd - mg - effective - try - cbdoil - cbdhealth - thc - hemp,0.981173448,FALSE
2376,pure and premium. our full-spectrum cbd oils are composed using a co2 extraction process for the cleanest and most effective formula. . shop now: . #hempworx #tincture #cbdoils #cbdoilshealth #cbdhealth #hemp #cbd #cannabis #cannabiscommunity #cbdoil,6,6_oil_oils_cbd_mg,oil - oils - cbd - mg - effective - try - cbdoil - cbdhealth - thc - hemp,0.211103655,FALSE
2545,what was it to many cbd oil jibes,6,6_oil_oils_cbd_mg,oil - oils - cbd - mg - effective - try - cbdoil - cbdhealth - thc - hemp,0.842807581,FALSE
2665,so sad cbd oil then?,6,6_oil_oils_cbd_mg,oil - oils - cbd - mg - effective - try - cbdoil - cbdhealth - thc - hemp,0.503521239,FALSE
2682,cbd and hash oil are not the same thing.,6,6_oil_oils_cbd_mg,oil - oils - cbd - mg - effective - try - cbdoil - cbdhealth - thc - hemp,1,FALSE
2749,"auckland tweeps, where to get reasonably priced cbd oil? tilray and helius are the main ones in nz, right?",6,6_oil_oils_cbd_mg,oil - oils - cbd - mg - effective - try - cbdoil - cbdhealth - thc - hemp,1,FALSE
2750,"it wasnt vape, it was cbd oil with a prescription.",6,6_oil_oils_cbd_mg,oil - oils - cbd - mg - effective - try - cbdoil - cbdhealth - thc - hemp,0.613942362,FALSE
2834,"why vera? simply put, our cbd oil is the very best available! % thc free purchase vera's cbd oil at learn more about the benefits of cbd oil #veraroasting #cbdoil #thcfree #cbdhealth",6,6_oil_oils_cbd_mg,oil - oils - cbd - mg - effective - try - cbdoil - cbdhealth - thc - hemp,0.947138456,FALSE
2874,"our cbd oils are rich in cbd, terpenes, flavonoids &amp; natural hemp compounds. try them today &amp; learn for yourself why our cbd oils are so highly regarded rapid delivery all across the uk % coupon social10 #hempura #cbdproductsuk #productswithcbd #cbdoil",6,6_oil_oils_cbd_mg,oil - oils - cbd - mg - effective - try - cbdoil - cbdhealth - thc - hemp,0.747963787,FALSE
2896,"i don't know what cbd oil is, but let's go for the special ones please!",6,6_oil_oils_cbd_mg,oil - oils - cbd - mg - effective - try - cbdoil - cbdhealth - thc - hemp,1,FALSE
2918,looking for great quality oil with or without thc! try canadian #1 oil! check it out!the % promo code: pin20! #cbd #cbdoil #cbdhealth #cbdwellness #cbdbenefits #cbdlife #cbdmovement #healthylifestyle #health #healthandwellness #cbdchocolate #cbdsale #new,6,6_oil_oils_cbd_mg,oil - oils - cbd - mg - effective - try - cbdoil - cbdhealth - thc - hemp,0.407296826,FALSE
2970,"on cbd, but i'll be getting regular oil just to see which one works faster. my order took months, hope my next doesn't take longer. i understand cause i stay on the other side of the planet",6,6_oil_oils_cbd_mg,oil - oils - cbd - mg - effective - try - cbdoil - cbdhealth - thc - hemp,0.983100591,FALSE
3412,rt : best delta thc oil and tinctures feat. #thc #cbd,6,6_oil_oils_cbd_mg,oil - oils - cbd - mg - effective - try - cbdoil - cbdhealth - thc - hemp,0.42466382,FALSE
3476,looking for great quality oil with or without thc! try canadian #1 oil! with the % promo code: pin20 find it here #cbd #cbdoil #cbdhealth #cbdwellness #cbdbenefits #cbdlife #cbdmovement #healthylifestyle #health #healthandwellness #branding #cbdsale #cat,6,6_oil_oils_cbd_mg,oil - oils - cbd - mg - effective - try - cbdoil - cbdhealth - thc - hemp,0.776704225,FALSE
3544,how to treat diabetes using cbd oil: the alternative no side effects treatment you can use to treat diabetes hssy8nv,6,6_oil_oils_cbd_mg,oil - oils - cbd - mg - effective - try - cbdoil - cbdhealth - thc - hemp,0.156098291,FALSE
3545,[fda] adhd meds or cbd oil which has the best outcome - connecticut jewish ledger || #adhdnews courtesy of the only in home tutor on oahu with adhd specializing in students with adhd. affordable private in home tutoring honolulu hawaii covering all of,6,6_oil_oils_cbd_mg,oil - oils - cbd - mg - effective - try - cbdoil - cbdhealth - thc - hemp,0.173622922,FALSE
3758,what's the difference between our mg cbd oil and our original formula cbd oil? they're crafted differently to serve yo...,6,6_oil_oils_cbd_mg,oil - oils - cbd - mg - effective - try - cbdoil - cbdhealth - thc - hemp,0.202061016,FALSE
3802,cbd oils and thc are essential for maintaining health of the body look into it,6,6_oil_oils_cbd_mg,oil - oils - cbd - mg - effective - try - cbdoil - cbdhealth - thc - hemp,0.227646052,FALSE
3813,cbd oil for spinal cord injury osazbmy,6,6_oil_oils_cbd_mg,oil - oils - cbd - mg - effective - try - cbdoil - cbdhealth - thc - hemp,0.220648303,FALSE
3851,"the flavored and unflavored cbd oils (cbd tinctures or cbd oral drops) we carry are infused with premium cbd-rich hemp oil, non-gmo, thc free, pesticide free and made in the usa",6,6_oil_oils_cbd_mg,oil - oils - cbd - mg - effective - try - cbdoil - cbdhealth - thc - hemp,0.927231173,FALSE
3872,"from my innerstanding, oil of oregano is like cbd, and oregano [essential] oil is like thc?...",6,6_oil_oils_cbd_mg,oil - oils - cbd - mg - effective - try - cbdoil - cbdhealth - thc - hemp,0.297526015,FALSE
3911,try cbd oil.,6,6_oil_oils_cbd_mg,oil - oils - cbd - mg - effective - try - cbdoil - cbdhealth - thc - hemp,0.945562815,TRUE
4087,cbd oil and stroke recovery: the ultimate guide on everything you need to know about cbd oil and stroke recovery zkkiowo,6,6_oil_oils_cbd_mg,oil - oils - cbd - mg - effective - try - cbdoil - cbdhealth - thc - hemp,0.226146919,FALSE
4163,how to vape cbd oil and get the most benefits. by dave kriegel,6,6_oil_oils_cbd_mg,oil - oils - cbd - mg - effective - try - cbdoil - cbdhealth - thc - hemp,1,FALSE
4296,rt : when the mg drop of cbd oil hits,6,6_oil_oils_cbd_mg,oil - oils - cbd - mg - effective - try - cbdoil - cbdhealth - thc - hemp,0.737050181,FALSE
4639,try some cbd oils they have worked for me. crazy dreams but lol,6,6_oil_oils_cbd_mg,oil - oils - cbd - mg - effective - try - cbdoil - cbdhealth - thc - hemp,0.599633354,FALSE
4642,mass migration impact is a digital book that contains a recipe to reproduce the blessing oil that is referenced in the book of scriptures. fixings in the item . cbd oil . olive oil . myrrh . cinnamon . acacia.,6,6_oil_oils_cbd_mg,oil - oils - cbd - mg - effective - try - cbdoil - cbdhealth - thc - hemp,0.556255769,FALSE
4720,thcohoney oil line shiyo420 #thco #cbn #cbd ### # #,6,6_oil_oils_cbd_mg,oil - oils - cbd - mg - effective - try - cbdoil - cbdhealth - thc - hemp,0.174037863,FALSE
4819,"rt : cbd oil for dementia: can it help? #cbd, #cannabis, #healthcare",6,6_oil_oils_cbd_mg,oil - oils - cbd - mg - effective - try - cbdoil - cbdhealth - thc - hemp,0.141914224,FALSE
4857,", . , , cbd oil. , . thc.",6,6_oil_oils_cbd_mg,oil - oils - cbd - mg - effective - try - cbdoil - cbdhealth - thc - hemp,0.541689743,TRUE
5102,best gold cbd oil for sell. his is the link; #bbclaurak #sundayvibes #maskedsingeruk #tabootoken #r3live_day2 #staley #mbius #inang # #r3live_day2 #miss usa #herbert #jags contact whatsap+34640391007,6,6_oil_oils_cbd_mg,oil - oils - cbd - mg - effective - try - cbdoil - cbdhealth - thc - hemp,0.670333769,FALSE
5127,rt : #thc #cbdhealth #cannabiscommunity cbd gummies vs #cbd oil can be a difficult choice to make. when comparingon whic,6,6_oil_oils_cbd_mg,oil - oils - cbd - mg - effective - try - cbdoil - cbdhealth - thc - hemp,0.152470999,FALSE
5128,"our happy paws raw organic living cbd rich hemp oil is a safe, effective and affordable way to help keep your fur family healthy and happy - grab it today at (link in profile) for % off with code detoxrocks-23 good until the end of the month!",6,6_oil_oils_cbd_mg,oil - oils - cbd - mg - effective - try - cbdoil - cbdhealth - thc - hemp,0.139266619,FALSE
5173,cbd oil in jhelum -,6,6_oil_oils_cbd_mg,oil - oils - cbd - mg - effective - try - cbdoil - cbdhealth - thc - hemp,0.633833573,FALSE
5182,motrin for inflammation or put some essential oils on that bih. or lol ive heard some of the cbd creams are very effective.,6,6_oil_oils_cbd_mg,oil - oils - cbd - mg - effective - try - cbdoil - cbdhealth - thc - hemp,0.146910162,FALSE
5187,"cbd oil helped me where tramadol couldn't, that was with a slipped disc.",6,6_oil_oils_cbd_mg,oil - oils - cbd - mg - effective - try - cbdoil - cbdhealth - thc - hemp,0.400049156,FALSE
5227,how cbd oil can improve your efficiency while working remotely #cbdoil #workfromhome,6,6_oil_oils_cbd_mg,oil - oils - cbd - mg - effective - try - cbdoil - cbdhealth - thc - hemp,0.307751106,FALSE
5319,"i have amazing offers right now at fantastic prices on my cbd oil in different flavours. natural, strawberry, mint &amp; blueberry. % mg, % mg, % mg, % mg &amp; % mg. if you are interested dm me and i will send you the offers.",6,6_oil_oils_cbd_mg,oil - oils - cbd - mg - effective - try - cbdoil - cbdhealth - thc - hemp,0.895859727,FALSE
5330,best cbd oil,6,6_oil_oils_cbd_mg,oil - oils - cbd - mg - effective - try - cbdoil - cbdhealth - thc - hemp,0.945739502,TRUE
5373,yes they are very effective. i use the full spectrum cbd oil that i get from netriusbin on instagram.,6,6_oil_oils_cbd_mg,oil - oils - cbd - mg - effective - try - cbdoil - cbdhealth - thc - hemp,0.472355102,FALSE
5442,cbd oil for horses,6,6_oil_oils_cbd_mg,oil - oils - cbd - mg - effective - try - cbdoil - cbdhealth - thc - hemp,0.967734581,FALSE
6013,the health benefits of cbd oil for your mind and your body. add cbd to your routine! #cbd #cbdoil,6,6_oil_oils_cbd_mg,oil - oils - cbd - mg - effective - try - cbdoil - cbdhealth - thc - hemp,0.205513683,FALSE
6401,rt : which is why the oil industry fights anything hemp. pharmaceuticals hate cbd too...,6,6_oil_oils_cbd_mg,oil - oils - cbd - mg - effective - try - cbdoil - cbdhealth - thc - hemp,0.28871195,FALSE
6442,"rt : active #cbd oils and vape oils - made in colorado, you know it's a quality product! ~j, discover cbd, affiliate https://",6,6_oil_oils_cbd_mg,oil - oils - cbd - mg - effective - try - cbdoil - cbdhealth - thc - hemp,0.918290283,FALSE
6556,"thank you! i bought cosequin, which looks the same without the asu, but if it doesnt seem to be working, ill try switching to dasuquin. id only been checking online for cbd oil and they all seem to be around $60+. i can try fish oil, too.",6,6_oil_oils_cbd_mg,oil - oils - cbd - mg - effective - try - cbdoil - cbdhealth - thc - hemp,1,FALSE
6604,i used to be on the mg cbd oil lad worked wonders for me need to get back on it tbh,6,6_oil_oils_cbd_mg,oil - oils - cbd - mg - effective - try - cbdoil - cbdhealth - thc - hemp,0.284390589,FALSE
6648,people often ask us how long cbd oil stays in your system. read the blog to find out,6,6_oil_oils_cbd_mg,oil - oils - cbd - mg - effective - try - cbdoil - cbdhealth - thc - hemp,1,FALSE
6752,cbd oil is great for hair on some real shit,6,6_oil_oils_cbd_mg,oil - oils - cbd - mg - effective - try - cbdoil - cbdhealth - thc - hemp,0.445162186,FALSE
6788,"try cbd oil. its very effective. reach out to netriusbin on instagram, he will help you with that",6,6_oil_oils_cbd_mg,oil - oils - cbd - mg - effective - try - cbdoil - cbdhealth - thc - hemp,0.33877517,FALSE
