,Document,Topic,Name,Top_n_words,Probability,Representative_document
6906,rt : common sense solutions to regulating #cannabis and #cbd. discusses what we might expect next.,18,18_fda_congress_regulate_regulating,fda - congress - regulate - regulating - supplements - regulations - food - says - seeks - foods,0.129098297,FALSE
7450,"also caffeine and weed. mfs would die without starbucks, thc, and cbd.",18,18_fda_congress_regulate_regulating,fda - congress - regulate - regulating - supplements - regulations - food - says - seeks - foods,0.215625357,FALSE
289,"five states will decide if they'll join others (and d.c.) in legalizing adult-use cannabis for ages +. look for arkansas' issue , maryland's question , missouri's constitutional amendment , north dakota's statutory measure , and south dakota's initiated measure .",19,19_states_legalized_legalize_state,states - legalized - legalize - state - recreational - maryland - dakota - missouri - measure - legal,0.665532262,TRUE
312,breaking: maryland has legalized cannabis for adults and over!,19,19_states_legalized_legalize_state,states - legalized - legalize - state - recreational - maryland - dakota - missouri - measure - legal,0.631829363,FALSE
313,rt : breaking: maryland has legalized cannabis for adults and over!,19,19_states_legalized_legalize_state,states - legalized - legalize - state - recreational - maryland - dakota - missouri - measure - legal,0.66942422,FALSE
326,"rt : so far, the only counties to have backed recreational cannabis in south dakota have been clay (usd), brookings (sdsu), zieba",19,19_states_legalized_legalize_state,states - legalized - legalize - state - recreational - maryland - dakota - missouri - measure - legal,0.766965506,FALSE
337,rt : cannabis legalised in two more us states,19,19_states_legalized_legalize_state,states - legalized - legalize - state - recreational - maryland - dakota - missouri - measure - legal,1,FALSE
372,"rt : two new states legalized marijuana. yes, three others defeated cannabis measures. but: zero states repealed their existing",19,19_states_legalized_legalize_state,states - legalized - legalize - state - recreational - maryland - dakota - missouri - measure - legal,0.72864154,TRUE
382,estados han autorizado el consumo recreativo del cannabis.,19,19_states_legalized_legalize_state,states - legalized - legalize - state - recreational - maryland - dakota - missouri - measure - legal,0.64100746,FALSE
400,rt : missouri is now the st state in the country to legalize cannabis!,19,19_states_legalized_legalize_state,states - legalized - legalize - state - recreational - maryland - dakota - missouri - measure - legal,0.654209745,FALSE
404,which states do you think will legalize cannabis next? no right or wrong answers #marijuana #cannabis,19,19_states_legalized_legalize_state,states - legalized - legalize - state - recreational - maryland - dakota - missouri - measure - legal,1,FALSE
420,"measure projected to fail, recreational cannabis will not be legalized statewide #cannabis",19,19_states_legalized_legalize_state,states - legalized - legalize - state - recreational - maryland - dakota - missouri - measure - legal,0.914261857,FALSE
473,rt : nearly half of all americans live in states with legalized recreational #cannabis. if you're a physician that thinks they won,19,19_states_legalized_legalize_state,states - legalized - legalize - state - recreational - maryland - dakota - missouri - measure - legal,0.66839154,FALSE
717,"but its apples and oranges. the map on the right depicts cannabis laws at the national level. if you were to depict that in the us, the whole map would be red.",19,19_states_legalized_legalize_state,states - legalized - legalize - state - recreational - maryland - dakota - missouri - measure - legal,1,FALSE
725,"rt : last week, missouri and maryland legalized recreational cannabis. will it be legally federally in the us?",19,19_states_legalized_legalize_state,states - legalized - legalize - state - recreational - maryland - dakota - missouri - measure - legal,0.90259941,FALSE
761,"rt : there is not a single us state that i believe has just cannabis laws. not one. if it's ""legal"" as many states claim it",19,19_states_legalized_legalize_state,states - legalized - legalize - state - recreational - maryland - dakota - missouri - measure - legal,0.956897787,FALSE
1185,"rt : with two states voting to legalize cannabis, heres where pot is now legal in america",19,19_states_legalized_legalize_state,states - legalized - legalize - state - recreational - maryland - dakota - missouri - measure - legal,0.940669818,FALSE
1762,adult-use #cannabis legalized in #missouri and #maryland! #marijuana,19,19_states_legalized_legalize_state,states - legalized - legalize - state - recreational - maryland - dakota - missouri - measure - legal,0.658337873,TRUE
2588,it is illegal to fly with cannabis in every state in the united states. you () knew you were a known person with an elevated profile and was also representing the usa on a world stage... ... by being careless and not following laws.,19,19_states_legalized_legalize_state,states - legalized - legalize - state - recreational - maryland - dakota - missouri - measure - legal,0.982104088,FALSE
2643,correct. cannabis is legal in many states. point?,19,19_states_legalized_legalize_state,states - legalized - legalize - state - recreational - maryland - dakota - missouri - measure - legal,1,FALSE
3028,rt : massachusetts will become the first recreational-use cannabis state in the nation in to adopt a cannabis-impaired drivi,19,19_states_legalized_legalize_state,states - legalized - legalize - state - recreational - maryland - dakota - missouri - measure - legal,0.894708744,FALSE
3050,cannabis state-of-play - - united states #cannabis,19,19_states_legalized_legalize_state,states - legalized - legalize - state - recreational - maryland - dakota - missouri - measure - legal,0.825229668,FALSE
3099,"more than states have recreational marijuana, but massachusetts will be the first to teach teens about cannabis-impaired driving.",19,19_states_legalized_legalize_state,states - legalized - legalize - state - recreational - maryland - dakota - missouri - measure - legal,0.882478978,FALSE
3848,it is where you are. for now the state controls the legality of cannabis. it is legal where i live and the police have ways to test for it - for dui purposes. i suspect the same will happen with guns once it is legalized in your state or country-wide.,19,19_states_legalized_legalize_state,states - legalized - legalize - state - recreational - maryland - dakota - missouri - measure - legal,1,FALSE
4287,which states will legalize marijuana in ? | cannabutter digest #cannabis,19,19_states_legalized_legalize_state,states - legalized - legalize - state - recreational - maryland - dakota - missouri - measure - legal,0.8716721,FALSE
5438,"rt : countries that have legalized recreational use of cannabis are canada, georgia, malta, mexico, south africa",19,19_states_legalized_legalize_state,states - legalized - legalize - state - recreational - maryland - dakota - missouri - measure - legal,1,FALSE
5877,five states that might legalize adult-use cannabis in via #legalizeit,19,19_states_legalized_legalize_state,states - legalized - legalize - state - recreational - maryland - dakota - missouri - measure - legal,0.73362918,FALSE
6323,would cannabis cafs be allowed in st. louis county? a proposed plan says yes.,19,19_states_legalized_legalize_state,states - legalized - legalize - state - recreational - maryland - dakota - missouri - measure - legal,1,FALSE
6410,"easy, cannabis is legal in most states.",19,19_states_legalized_legalize_state,states - legalized - legalize - state - recreational - maryland - dakota - missouri - measure - legal,1,FALSE
6465,"commissioner, when will cannabis me legal in this great state?",19,19_states_legalized_legalize_state,states - legalized - legalize - state - recreational - maryland - dakota - missouri - measure - legal,0.919895773,FALSE
6472,"rt : the sunshine state could legalize adult-use cannabis next year, as a proposed constitutional amendment to get au on the",19,19_states_legalized_legalize_state,states - legalized - legalize - state - recreational - maryland - dakota - missouri - measure - legal,0.66942422,FALSE
6681,"rt : ron desantis and the gop legislature have repeatedly blocked our freedom to legal cannabis in florida. year after year,",19,19_states_legalized_legalize_state,states - legalized - legalize - state - recreational - maryland - dakota - missouri - measure - legal,0.667908303,FALSE
7147,i think the only good thing about usa is that you can buy cannabis in some states for recreational use and not be jailed.,19,19_states_legalized_legalize_state,states - legalized - legalize - state - recreational - maryland - dakota - missouri - measure - legal,0.993287848,FALSE
7353,rt : states that could legalize cannabis in #legalizeit #legalizecannabis #usa #cannabiscommunity #scoopit #highusa,19,19_states_legalized_legalize_state,states - legalized - legalize - state - recreational - maryland - dakota - missouri - measure - legal,0.66942422,FALSE
7438,"rt : ""although cannabis remains illegal at the federal level, as of december , roughly /4 of states have operational, legal market",19,19_states_legalized_legalize_state,states - legalized - legalize - state - recreational - maryland - dakota - missouri - measure - legal,1,FALSE
7777,the # farms that can reinvent to cannabis with permit is minuscule. for the vast majority of ny farms our product of whole milk remains unlawful in ny schools.,19,19_states_legalized_legalize_state,states - legalized - legalize - state - recreational - maryland - dakota - missouri - measure - legal,0.826282256,FALSE
8620,"rt : as many u.s. states adopt policies that legalize the commercialization of cannabis, a new center at yale school of medicine will",19,19_states_legalized_legalize_state,states - legalized - legalize - state - recreational - maryland - dakota - missouri - measure - legal,1,FALSE
148,accidentally double-dosed on cbd shit's about to get craaaazy,20,20_clothes_cbd_ima_yea,clothes - cbd - ima - yea - shoulder - bf - wears - voy - magazine - didnt,0.681409383,FALSE
194,"if you saw me at foxtrot getting a cbd seltzer, no you didnt",20,20_clothes_cbd_ima_yea,clothes - cbd - ima - yea - shoulder - bf - wears - voy - magazine - didnt,1,FALSE
230,just a wild guess here. but i dont think it was literally just cbd lol,20,20_clothes_cbd_ima_yea,clothes - cbd - ima - yea - shoulder - bf - wears - voy - magazine - didnt,0.983089573,FALSE
2086,im chilling by death... cbd..,20,20_clothes_cbd_ima_yea,clothes - cbd - ima - yea - shoulder - bf - wears - voy - magazine - didnt,0.713713331,FALSE
2291,it was so funny but cbd deserves more,20,20_clothes_cbd_ima_yea,clothes - cbd - ima - yea - shoulder - bf - wears - voy - magazine - didnt,1,FALSE
2425,ima be a musician. ima fuck up my life. #cbd,20,20_clothes_cbd_ima_yea,clothes - cbd - ima - yea - shoulder - bf - wears - voy - magazine - didnt,0.857168876,FALSE
2633,it wasnt cbd. read up on it.,20,20_clothes_cbd_ima_yea,clothes - cbd - ima - yea - shoulder - bf - wears - voy - magazine - didnt,0.854025982,FALSE
2761,rt : the cbd is dead i mutter repeatedly to myself as i squeeze shoulder to shoulder along swanston st with thousands of people.,20,20_clothes_cbd_ima_yea,clothes - cbd - ima - yea - shoulder - bf - wears - voy - magazine - didnt,1,TRUE
2840,i cant tell if this is sarcasm or not i didnt expect it anyway to be this nice a cbd,20,20_clothes_cbd_ima_yea,clothes - cbd - ima - yea - shoulder - bf - wears - voy - magazine - didnt,1,FALSE
3200,me estaba sintiendo de la vrg pero tome mi cbd y wow,20,20_clothes_cbd_ima_yea,clothes - cbd - ima - yea - shoulder - bf - wears - voy - magazine - didnt,1,FALSE
3691,"a movie about cbd called ""not baked""",20,20_clothes_cbd_ima_yea,clothes - cbd - ima - yea - shoulder - bf - wears - voy - magazine - didnt,0.771743176,FALSE
3770,rt : me gone off cbd seltzers,20,20_clothes_cbd_ima_yea,clothes - cbd - ima - yea - shoulder - bf - wears - voy - magazine - didnt,0.760820771,FALSE
3801,pues creo que voy a volver al cbd,20,20_clothes_cbd_ima_yea,clothes - cbd - ima - yea - shoulder - bf - wears - voy - magazine - didnt,0.798463212,FALSE
4088,just a stone throw away from cbd!,20,20_clothes_cbd_ima_yea,clothes - cbd - ima - yea - shoulder - bf - wears - voy - magazine - didnt,0.726886435,FALSE
4185,got the cbd lets fuckin go,20,20_clothes_cbd_ima_yea,clothes - cbd - ima - yea - shoulder - bf - wears - voy - magazine - didnt,0.910565281,FALSE
4189,verdaderamente fui. cbd del cbd guy,20,20_clothes_cbd_ima_yea,clothes - cbd - ima - yea - shoulder - bf - wears - voy - magazine - didnt,1,FALSE
4605,cbd yonke phela le,20,20_clothes_cbd_ima_yea,clothes - cbd - ima - yea - shoulder - bf - wears - voy - magazine - didnt,0.751587557,FALSE
4624,rt : in the witness today: pietermaritzburg cbd in a state of decay | no relief for turners daughters after years | the anc,20,20_clothes_cbd_ima_yea,clothes - cbd - ima - yea - shoulder - bf - wears - voy - magazine - didnt,0.85080429,FALSE
5290,why someone tell him to get back on cbd,20,20_clothes_cbd_ima_yea,clothes - cbd - ima - yea - shoulder - bf - wears - voy - magazine - didnt,0.910659495,FALSE
5831,"he been on the al harrington viola pack, def gonna be back sooner than expected bc of the cbd healing",20,20_clothes_cbd_ima_yea,clothes - cbd - ima - yea - shoulder - bf - wears - voy - magazine - didnt,1,FALSE
5929,nigga tried to finesse me with the cbd pack.,20,20_clothes_cbd_ima_yea,clothes - cbd - ima - yea - shoulder - bf - wears - voy - magazine - didnt,1,FALSE
6125,"yea //found out the clothes the cbd bf wears are his date clothes. so, he does wear the same clothes as og bf wears",20,20_clothes_cbd_ima_yea,clothes - cbd - ima - yea - shoulder - bf - wears - voy - magazine - didnt,0.821083821,TRUE
6226,i can only laughthis is utterly insane. cbd!!!,20,20_clothes_cbd_ima_yea,clothes - cbd - ima - yea - shoulder - bf - wears - voy - magazine - didnt,0.710116168,FALSE
6257,me &amp; my cbd vape against the world,20,20_clothes_cbd_ima_yea,clothes - cbd - ima - yea - shoulder - bf - wears - voy - magazine - didnt,0.961192128,FALSE
6765,did jonah find the thc in cbd?,20,20_clothes_cbd_ima_yea,clothes - cbd - ima - yea - shoulder - bf - wears - voy - magazine - didnt,0.993703064,FALSE
6771,i am. i believe it was because i was on his d3 cbd tumeric ginger,20,20_clothes_cbd_ima_yea,clothes - cbd - ima - yea - shoulder - bf - wears - voy - magazine - didnt,1,FALSE
6797,hawking is messing up the cbd. do something,20,20_clothes_cbd_ima_yea,clothes - cbd - ima - yea - shoulder - bf - wears - voy - magazine - didnt,0.700443295,FALSE
7255,"cool time, stima mmolo ke r4.00 nou? i was so disturbed by the price of everything, i didn't even realize my boob was hanging out of my top ko cbd",20,20_clothes_cbd_ima_yea,clothes - cbd - ima - yea - shoulder - bf - wears - voy - magazine - didnt,0.960709134,TRUE
7279,yea i said the same thing to the other girl as far as i would say use cbd over thc for sure,20,20_clothes_cbd_ima_yea,clothes - cbd - ima - yea - shoulder - bf - wears - voy - magazine - didnt,0.827800243,FALSE
7778,anyone in jhb cbd wanna get their dikana sucked on?,20,20_clothes_cbd_ima_yea,clothes - cbd - ima - yea - shoulder - bf - wears - voy - magazine - didnt,0.877020014,FALSE
7785,me after two hits of a gas station cbd pen,20,20_clothes_cbd_ima_yea,clothes - cbd - ima - yea - shoulder - bf - wears - voy - magazine - didnt,0.843985942,FALSE
7810,throwback to the time we could walk around durban cbd. but look how cute i was huh #throwbackthursday #tbt,20,20_clothes_cbd_ima_yea,clothes - cbd - ima - yea - shoulder - bf - wears - voy - magazine - didnt,1,FALSE
8135,ahora vapeo y me voy a pasar al cbd soy completamente maricon,20,20_clothes_cbd_ima_yea,clothes - cbd - ima - yea - shoulder - bf - wears - voy - magazine - didnt,0.88222571,FALSE
8446,"so, i googled ""i was in forbes magazine,"" and learned the mystery. he was in the magazine for being ceo of a cbd vending machine. #readytolove",20,20_clothes_cbd_ima_yea,clothes - cbd - ima - yea - shoulder - bf - wears - voy - magazine - didnt,0.883847152,FALSE
8624,rt : flog of a premier dan andrews covering up the report on a second injecting room in the cbd. why?,20,20_clothes_cbd_ima_yea,clothes - cbd - ima - yea - shoulder - bf - wears - voy - magazine - didnt,0.744189486,FALSE
226,rt : curaleaf holdings (142 cannabis dispensaries in states) reports q3 revenue of $340m (7% yoy increase),21,21_sales_billion_million_rev,sales - billion - million - rev - revenue - prices - raised - ebitda - record - reports,1,FALSE
369,cannabis curaleaf crece la multinacional de cannabis inform que sus ingresos totales aumentaron un % a usd millones durante el tercer trimestre de . va,21,21_sales_billion_million_rev,sales - billion - million - rev - revenue - prices - raised - ebitda - record - reports,1,FALSE
412,"rt : john boehner stands to make $25 millions off marijuana from the potential sale of acreage holdings, the cannabis-investment",21,21_sales_billion_million_rev,sales - billion - million - rev - revenue - prices - raised - ebitda - record - reports,1,FALSE
1119,$600 million and counting spent on colorado cannabis acquisitions in - #rockydailynews,21,21_sales_billion_million_rev,sales - billion - million - rev - revenue - prices - raised - ebitda - record - reports,0.607031964,FALSE
1617,"frm nu hall of famer:$500m co-gen deal-software co sold $120m-dealership,$20m rev,$3m ebitda+$45m raised-$500m gen power-took public healthcare deals,total $75m rev,$4m ebitda-raised $750k cannabis co-raised $5.5m fintech with $5m rev+$1m ebitda(dsp:he believed frm day )",21,21_sales_billion_million_rev,sales - billion - million - rev - revenue - prices - raised - ebitda - record - reports,0.802425503,TRUE
2100,rt : the booming legal cannabis market has plenty of upside $msos,21,21_sales_billion_million_rev,sales - billion - million - rev - revenue - prices - raised - ebitda - record - reports,0.641053134,FALSE
2221,rt : know your cbd! the cannabis extract market is set to hit $15.5 billion by . with cannabis legalization occurring in,21,21_sales_billion_million_rev,sales - billion - million - rev - revenue - prices - raised - ebitda - record - reports,1,FALSE
2279,$acb aurora cannabis repurchases ~$103 million principal amount of convertible notes; balance sheet among strongest in industry seconds delayed.,21,21_sales_billion_million_rev,sales - billion - million - rev - revenue - prices - raised - ebitda - record - reports,0.785789858,TRUE
2280,aurora cannabis repurchases ~$103 million principal amount of convertible notes; balance sheet among strongest in industry #cannabis,21,21_sales_billion_million_rev,sales - billion - million - rev - revenue - prices - raised - ebitda - record - reports,0.806635465,TRUE
2360,"*estadistica del da* con un record de us$24 mil millones en ventas durante y proyecciones de ventas anuales de us$70 mil millones para , el mercado de cannabis de eeuu.",21,21_sales_billion_million_rev,sales - billion - million - rev - revenue - prices - raised - ebitda - record - reports,1,FALSE
2727,"beverage alcohol sales for q2 were $82.4 million, up per cent over the same period in , but cannabis sales through licensed retailers totalled $17.7 million in q2, a per cent increase.",21,21_sales_billion_million_rev,sales - billion - million - rev - revenue - prices - raised - ebitda - record - reports,1,FALSE
2837,arizona cannabis sales soar; heres how big its becoming.,21,21_sales_billion_million_rev,sales - billion - million - rev - revenue - prices - raised - ebitda - record - reports,0.729193146,FALSE
3024,recreational cannabis prices in mass. plummet as dispensary owners weigh future,21,21_sales_billion_million_rev,sales - billion - million - rev - revenue - prices - raised - ebitda - record - reports,0.607908773,FALSE
3429,they should try the predatory pricing policy of the bc cannabis stores.,21,21_sales_billion_million_rev,sales - billion - million - rev - revenue - prices - raised - ebitda - record - reports,0.626529262,FALSE
3472,"canada house cannabis group reports q1 fiscal year financial results with record revenue, positive cash flow and operating profit $chv",21,21_sales_billion_million_rev,sales - billion - million - rev - revenue - prices - raised - ebitda - record - reports,0.892801245,FALSE
3703,#etf top gainer - details ticker: $msos name/issuer: advisorshares pure us cannabis etf change (%): current price: $7.21,21,21_sales_billion_million_rev,sales - billion - million - rev - revenue - prices - raised - ebitda - record - reports,0.689246304,FALSE
3817,"x nba champion isiah thomas made $3 million cannabis investment in , joining ...",21,21_sales_billion_million_rev,sales - billion - million - rev - revenue - prices - raised - ebitda - record - reports,0.664013899,FALSE
4236,". . though estimate$ indicate ca cannabis production marketing &amp; infrastructure generate nearly $10 b gdp only $ , t eted since .. .",21,21_sales_billion_million_rev,sales - billion - million - rev - revenue - prices - raised - ebitda - record - reports,0.75637598,FALSE
4487,canada house cannabis group reports q1 fiscal year financial results with record revenue,21,21_sales_billion_million_rev,sales - billion - million - rev - revenue - prices - raised - ebitda - record - reports,1,FALSE
4571,rt : il legal cannabis sales hit an all time high in december. $msos $psdn $gtbif $crlbf $aawh $curlf $vrnof,21,21_sales_billion_million_rev,sales - billion - million - rev - revenue - prices - raised - ebitda - record - reports,1,FALSE
4622,rt : recreational cannabis sales see record high $28 million,21,21_sales_billion_million_rev,sales - billion - million - rev - revenue - prices - raised - ebitda - record - reports,0.684307179,FALSE
4654,rt : could ct's retail sales of recreational cannabis lead to spike in driving high? here's why the law enforcement communi,21,21_sales_billion_million_rev,sales - billion - million - rev - revenue - prices - raised - ebitda - record - reports,0.628473384,FALSE
5205,rt : weed prices tanking while grocery prices to the moon || canadian cannabis industry struggling amid oversupply challenges | ht,21,21_sales_billion_million_rev,sales - billion - million - rev - revenue - prices - raised - ebitda - record - reports,0.663791766,FALSE
5258,american cannabis (otcmkts:ammj) share price crosses below -day moving average of $0.04 - defense ... #cannabis,21,21_sales_billion_million_rev,sales - billion - million - rev - revenue - prices - raised - ebitda - record - reports,1,FALSE
6393,cannabis producer tilray quietly drops $4 billion sales target for via,21,21_sales_billion_million_rev,sales - billion - million - rev - revenue - prices - raised - ebitda - record - reports,0.606001821,FALSE
6430,rt : latest: cannabis producer tilray appears to have quietly dropped its $4 billion sales target for analysts are now f,21,21_sales_billion_million_rev,sales - billion - million - rev - revenue - prices - raised - ebitda - record - reports,0.644260221,FALSE
6692,cannabis store once worth $1.7 billion is now nearlyfailing,21,21_sales_billion_million_rev,sales - billion - million - rev - revenue - prices - raised - ebitda - record - reports,0.680291525,FALSE
7433,"rt : the cannabis industry is poised to reach more than $31.8 billion in annual sales by the end of this year, with a projec",21,21_sales_billion_million_rev,sales - billion - million - rev - revenue - prices - raised - ebitda - record - reports,1,FALSE
7618,canadian wholesale cannabis prices are off more than % in -,21,21_sales_billion_million_rev,sales - billion - million - rev - revenue - prices - raised - ebitda - record - reports,0.654370193,FALSE
7634,"rt : in some of the most mature legal cannabis markets across the u.s., sales are declining after surging earlier in the pandemic. inv",21,21_sales_billion_million_rev,sales - billion - million - rev - revenue - prices - raised - ebitda - record - reports,0.626529262,FALSE
7772,"revenue seize cannabis, cigarettes and tobacco worth almost m at dublin port and athlone",21,21_sales_billion_million_rev,sales - billion - million - rev - revenue - prices - raised - ebitda - record - reports,0.689403234,FALSE
8072,"rt : did you know that the north america legal cannabis market is currently worth over $35 billion? today, you have the opportuni",21,21_sales_billion_million_rev,sales - billion - million - rev - revenue - prices - raised - ebitda - record - reports,0.902372684,FALSE
8353,"rt : rising costs of cannabis retail. unofficial cannabis levy youre selling cannabis, you must be making loads therefor",21,21_sales_billion_million_rev,sales - billion - million - rev - revenue - prices - raised - ebitda - record - reports,0.644955234,FALSE
8390,rt : total sales of cannabis in massachusetts since the first dispensaries opened in have surpassed $4 billion. https:/,21,21_sales_billion_million_rev,sales - billion - million - rev - revenue - prices - raised - ebitda - record - reports,0.869675411,FALSE
204,rt : my phd student is recruiting for his lab study investigating brain activity to cannabis cues / images. eligibility cri,22,22_brain_dopamine_cognitive_cause,brain - dopamine - cognitive - cause - cerebral - psicoactivos - dficits - agudos - functions - perjudica,0.689674049,FALSE
279,"rt : thc in #cannabis, even in low concentrations, can cause psychosis. and out of the drugs that can cause a temporary epis",22,22_brain_dopamine_cognitive_cause,brain - dopamine - cognitive - cause - cerebral - psicoactivos - dficits - agudos - functions - perjudica,0.397767167,FALSE
